game_id	period_id	event_id	team_text	team_score	opponent_score	score	opponent_text
3786927	2	25	Showers doubled down the lf line, RBI (1-2); Kaczmarski scored.	3	2	3-2	
3786927	2	26	McKibban grounded out to 2b (2-1); Showers advanced to third.				
3786927	2	27	Ramon grounded out to p (0-0).				
3786927	2	28					Sila singled to pitcher (1-0).
3786927	2	29					Scott singled to right field (1-0); Sila advanced to third.
3786927	2	30		3	3	3-3	Steelmon singled to right field, RBI (0-0); Scott advanced to second; Sila scored.
3786927	2	31					Rockwell popped up to 1b (1-1).
3786927	2	32		3	4	3-4	Kirk singled up the middle, RBI (1-2); Steelmon advanced to second; Scott scored.
3786927	2	33					Vogel reached on a fielder's choice (1-0); Kirk out at second ss to 2b; Steelmon advanced to third.
3786927	2	34		3	5	3-5	Gillean singled to left field, RBI (0-0); Vogel advanced to second; Steelmon scored.
3786927	2	35					Merten hit by pitch (0-0); Gillean advanced to second; Vogel advanced to third.
3786927	2	36		3	6	3-6	Scheuler walked, RBI (3-2); Merten advanced to second; Gillean advanced to third; Vogel scored.
3786927	2	37					Sila flied out to rf (3-1).
3786927	2	38	R: 2 H: 2 E: 1 LOB: 1	3	6	3-6	R: 4 H: 5 E: 0 LOB: 3
3786927	3	39	Lipari popped up to 1b (3-2).				
3786927	3	40	Sullivan struck out swinging, reached first on a passed ball (1-2).				
3786927	3	41	Perry struck out swinging (1-2).				
3786927	3	42	Sullivan out at second c to 1b to ss, caught stealing.				
3786927	3	43					Billo to p for Strain.
3786927	3	44					Scott walked (3-1).
3786927	3	45					Steelmon grounded into double play ss to 2b to 1b (2-0); Scott out on the play.
3786927	3	46					Rockwell walked (3-2).
3786927	3	47					Kirk singled to right field; Rockwell advanced to second.
3786927	3	48					Kirk advanced to second on a wild pitch; Rockwell advanced to third on a wild pitch.
3786927	3	49					Vogel grounded out to 2b (2-2).
3786927	3	50	R: 0 H: 0 E: 0 LOB: 0	3	6	3-6	R: 0 H: 1 E: 0 LOB: 2
3786927	4	51	Jyawook grounded out to 2b (0-1).				
3786927	4	52	Kaczmarski hit by pitch (1-2).				
3786927	4	53	Synek reached on a fielder's choice; Kaczmarski out at second p to ss.				
3786927	4	54	Showers popped up to c (1-1).				
3786927	4	55					Gillean struck out swinging (1-2).
3786927	4	56					Merten reached on an error by 3b (2-1).
3786927	4	57					Scheuler fouled out to c (3-2).
3786927	4	58					Sila lined out to p (1-2).
3786927	4	59	R: 0 H: 0 E: 0 LOB: 1	3	6	3-6	R: 0 H: 0 E: 1 LOB: 1
3786927	5	60	Malcom to p for Allen.				
3786927	5	61	McKibban grounded out to 2b (3-2).				
3786927	5	62	Ramon struck out swinging (0-2).				
3786927	5	63	Lipari fouled out to c (0-1).				
3786927	5	64					Scott singled to right field (0-0).
3786927	5	65					Steelmon singled to shortstop (2-2); Scott advanced to second.
3786927	5	66					Rockwell grounded into double play ss to 2b to 1b (0-0); Steelmon out on the play; Scott advanced to third.
3786927	5	67					Kirk grounded out to ss (0-0).
3786927	5	68	R: 0 H: 0 E: 0 LOB: 0	3	6	3-6	R: 0 H: 2 E: 0 LOB: 1
3786927	6	69	Sullivan grounded out to 2b (1-1).				
3786927	6	70	Perry flied out to cf (1-2).				
3786927	6	71	Jyawook singled to shortstop (2-1).				
3786927	6	72	Kaczmarski grounded out to 2b (3-1).				
3786927	6	73					Vogel grounded out to 3b (0-2).
3786927	6	74					Gillean struck out looking (0-2).
3786927	6	75					Merten struck out swinging (1-2).
3786927	6	76	R: 0 H: 1 E: 0 LOB: 1	3	6	3-6	R: 0 H: 0 E: 0 LOB: 0
3786927	7	77	Synek singled up the middle (0-0).				
3786927	7	78	Showers flied out to rf (2-2).				
3786927	7	79	McKibban singled through the right side (0-1); Synek advanced to third.				
3786927	7	80	Ramon popped up to 2b (0-0).				
3786927	7	81	Williams pinch ran for Lipari.				
3786927	7	82	Williams pinch hit.				
3786927	7	83	Williams flied out to rf.				
3786927	7	84					Tokarek to c for Williams.
3786927	7	85					Scheuler struck out swinging (1-2).
3786927	7	86					Sila grounded out to p, bunt.
3786927	7	87					Scott walked (3-2).
3786927	7	88					Scott stole second.
3786927	7	89					Steelmon walked (3-1).
3786927	7	90					Rockwell singled to third base (1-2); Steelmon advanced to second; Scott advanced to third.
3786927	7	91					Kirk grounded out to 2b (1-1).
3786927	7	92	R: 0 H: 2 E: 0 LOB: 2	3	6	3-6	R: 0 H: 1 E: 0 LOB: 3
3786927	8	93	Foley pinch hit for Sullivan.				
3786927	8	94	Foley struck out looking (2-2).				
3786927	8	95	Perry struck out swinging (2-2).				
3786927	8	96	Jyawook grounded out to 2b (0-2).				
3786927	8	97	R: 0 H: 0 E: 0 LOB: 0	3	6	3-6	
3788745	0	0	Jyawook singled up the middle.				
3788745	0	1	Synek doubled to right field: Jyawook advanced to third.				
3788745	0	2	Kaczmarski singled up the middle, 2 RBI: Synek scored: Jyawook scored.	2	0	2-0	
3788745	0	3	Kaczmarski stole second.				
3788745	0	4	Showers struck out swinging.				
3788745	0	5	McKibban flied out to lf.				
3788745	0	6	Williams walked.				
3788745	0	7	Ramon struck out swinging.				
3788745	0	8					Sila singled to third base, bunt.
3788745	0	9					Scott flied out to lf.
3788745	0	10					Steelmon grounded into double play ss to 2b to 1b: Sila out on the play.
3788745	0	11	R: 2 H: 3 E: 0 LOB: 2	2	0	2-0	R: 0 H: 1 E: 0 LOB: 0
3788745	1	12	Tokarek hit by pitch.				
3788745	1	13	Perry struck out swinging.				
3788745	1	14	Jyawook walked: Tokarek advanced to second.				
3788745	1	15	Synek doubled to left field, RBI: Jyawook advanced to third: Tokarek scored.	3	0	3-0	
3788745	1	16	Kaczmarski singled up the middle, 2 RBI: Synek scored: Jyawook scored.	5	0	5-0	
3788745	1	17	Showers struck out swinging: Kaczmarski advanced to second on a wild pitch.				
3788745	1	18	McKibban walked.				
3788745	1	19	Williams flied out to cf.				
3788745	1	20					Rockwell walked.
3788745	1	21					Kirk struck out swinging.
3788745	1	22					Vogel struck out swinging.
3788745	1	23					Gillean walked: Rockwell advanced to second.
3788745	1	24					Merten struck out swinging.
3788745	1	25	R: 3 H: 2 E: 0 LOB: 2	5	0	5-0	R: 0 H: 0 E: 0 LOB: 2
3788745	2	26	Ramon struck out swinging.				
3788745	2	27	Tokarek flied out to lf.				
3788745	2	28	Perry grounded out to 1b unassisted.				
3788745	2	29					Scheuler flied out to rf.
3788745	2	30					Sila grounded out to 3b.
3788745	2	31					Scott singled to pitcher.
3788745	2	32					Steelmon reached on a fielder's choice: Scott out at second ss to 2b.
3788745	2	33	R: 0 H: 0 E: 0 LOB: 0	5	0	5-0	R: 0 H: 1 E: 0 LOB: 1
3788745	3	34	Willenborg to p for Thoele.				
3788745	3	35	Jyawook grounded out to 2b.				
3788745	3	36	Synek flied out to lf.				
3788745	3	37	Kaczmarski walked.				
3788745	3	38	Kaczmarski out at second c to ss, caught stealing.				
3788745	3	39					Rockwell struck out swinging.
3788745	3	40					Kirk grounded out to 1b unassisted.
3788745	3	41					Vogel hit by pitch.
3788745	3	42					Gillean flied out to rf.
3788745	3	43	R: 0 H: 0 E: 0 LOB: 0	5	0	5-0	R: 0 H: 0 E: 0 LOB: 1
3788745	4	44	Showers grounded out to ss.				
3788745	4	45	McKibban grounded out to ss.				
3788745	4	46	Williams struck out swinging.				
3788745	4	47					Merten doubled to right center.
3788745	4	48					Scheuler singled through the left side: Merten advanced to third.
3788745	4	49		5	1	5-1	Sila reached on an error by 2b, RBI: Scheuler advanced to second: Merten scored, unearned.
3788745	4	50					Barret pinch hit for Scott.
3788745	4	51					Barret struck out swinging.
3788745	4	52					Steelmon singled to second base: Sila advanced to second: Scheuler advanced to third.
3788745	4	53		5	2	5-2	Rockwell flied out to cf, SAC, RBI: Sila advanced to third: Scheuler scored, unearned.
3788745	4	54					Kirk popped up to ss.
3788745	4	55	R: 0 H: 0 E: 0 LOB: 0	5	2	5-2	R: 2 H: 3 E: 1 LOB: 2
3788745	5	56	Ramon flied out to lf.				
3788745	5	57	Tokarek flied out to cf.				
3788745	5	58	Perry doubled down the lf line.				
3788745	5	59	Jyawook walked.				
3788745	5	60	No play.				
3788745	5	61	Synek flied out to cf.				
3788745	5	62					Schnieders to p for Rodgers.
3788745	5	63					Vogel struck out swinging.
3788745	5	64					Gillean grounded out to ss.
3788745	5	65					No play.
3788745	5	66					Merten singled to pitcher.
3788745	5	67					Scheuler flied out to cf.
3788745	5	68	R: 0 H: 1 E: 0 LOB: 2	5	2	5-2	R: 0 H: 1 E: 0 LOB: 1
3788745	6	69	Garcia to p for Willenborg.				
3788745	6	70	Kaczmarski flied out to cf.				
3788745	6	71	Showers popped up to 2b.				
3788745	6	72	McKibban grounded out to 2b.				
3788745	6	73					Barret to dh.
3788745	6	74					Sila grounded out to 2b.
3788745	6	75					Barret walked.
3788745	6	76					Steelmon flied out to rf.
3788745	6	77					Rockwell fouled out to 3b.
3788745	6	78	R: 0 H: 0 E: 0 LOB: 0	5	2	5-2	R: 0 H: 0 E: 0 LOB: 1
3788745	7	79	Brownmiller to p for Garcia.				
3788745	7	80	Williams doubled to right field.				
3788745	7	81	Ramon reached on an error by 3b.				
3788745	7	82	Tokarek out at first c to 2b, SAC, bunt: Ramon advanced to second: Williams advanced to third.				
3788745	7	83	Perry struck out swinging.				
3788745	7	84	Jyawook singled to right field, 2 RBI: Ramon scored, unearned: Williams scored, unearned.	7	2	7-2	
3788745	7	85	Synek reached on a fielder's choice: Jyawook out at second 2b to ss.				
3788745	7	86					Martin pinch hit for Kirk.
3788745	7	87					Martin walked.
3788745	7	88					Martin advanced to second on a wild pitch.
3788745	7	89					Vogel walked.
3788745	7	90					Gillean flied out to cf.
3788745	7	91					Merten struck out looking.
3788745	7	92					Scheuler walked: Vogel advanced to second: Martin advanced to third.
3788745	7	93					Sila flied out to cf.
3788745	7	94	R: 2 H: 2 E: 1 LOB: 1	7	2	7-2	R: 0 H: 0 E: 0 LOB: 3
3788745	8	95	Martin to 2b.				
3788745	8	96	Kaczmarski grounded out to 2b.				
3788745	8	97	Showers popped up to ss.				
3788745	8	98	McKibban singled up the middle.				
3788745	8	99	McKibban advanced to second on a wild pitch.				
3788745	8	100	Williams out at first 1b to p.				
3788745	8	101					Barret struck out swinging.
3788745	8	102					Steelmon grounded out to ss.
3788745	8	103					Rockwell walked.
3788745	8	104					Martin walked: Rockwell advanced to second.
3788745	8	105					Vogel walked: Martin advanced to second: Rockwell advanced to third.
3788745	8	106					Gillean struck out swinging.
3788745	8	107	R: 0 H: 1 E: 0 LOB: 1	7	2	7-2	R: 0 H: 0 E: 0 LOB: 3
3787869	0	0	Giles to ss for Creighton.				
3787869	0	1	Parenty grounded out to 1b unassisted.				
3787869	0	2	Chavarria singled to right field (0-2 KK).				
3787869	0	3	Chavarria advanced to second on a wild pitch.				
3787869	0	4	Peragine grounded out to ss (2-2 BSBS): Chavarria advanced to third.				
3787869	0	5	Baker walked (3-0 BBBB).				
3787869	0	6	Caputo struck out swinging (3-2 FBFFBBS).				
3787869	0	7					Holt, J. popped up to ss (0-0).
3787869	0	8					Wehby, G grounded out to ss (0-2 KF).
3787869	0	9					Correa, C. struck out swinging, out at first c to 1b (2-2 BKBFFS).
3787869	0	10	R: 0 H: 1 E: 0 LOB: 2	0	0	0-0	R: 0 H: 0 E: 0 LOB: 0
3787869	1	11	Handley flied out to cf (2-1 FBB).				
3787869	1	12	Gazzola singled to right field (0-0).				
3787869	1	13	Honeyman doubled down the rf line (0-2 SS): Gazzola advanced to third.				
3787869	1	14	Giles popped up to ss (1-0 B).				
3787869	1	15	Parenty singled to left field, RBI (1-0 B): Honeyman advanced to third, out at home lf to c: Gazzola scored.	1	0	1-0	
3787869	1	16					Stevens, S. flied out to lf (0-0).
3787869	1	17					Shermer, A. grounded out to p (0-0).
3787869	1	18					Reese, K. grounded out to 2b (1-1 SB).
3787869	1	19	R: 1 H: 3 E: 0 LOB: 1	1	0	1-0	R: 0 H: 0 E: 0 LOB: 0
3787869	2	20	Chavarria hit by pitch (0-1 K).				
3787869	2	21	Chavarria stole second.				
3787869	2	22	Peragine grounded out to 1b unassisted (3-2 KBFBBF): Chavarria advanced to third.				
3787869	2	23	Baker struck out swinging (1-2 FBSS).				
3787869	2	24	Caputo reached on an error by 2b (0-1 K): Chavarria scored, unearned.	2	0	2-0	
3787869	2	25	Handley struck out swinging (1-2 SBKS).				
3787869	2	26					Vandevere, T struck out swinging (0-2 KKS).
3787869	2	27					Zorn, D. popped up to 3b (2-2 KBFFBF).
3787869	2	28					Morales, J. fouled out to 1b (3-2 BKBFFBF).
3787869	2	29	R: 1 H: 0 E: 1 LOB: 1	2	0	2-0	R: 0 H: 0 E: 0 LOB: 0
3787869	3	30	Gazzola flied out to lf (2-2 KSBFB).				
3787869	3	31	Honeyman grounded out to ss (2-1 BBK).				
3787869	3	32	Giles struck out looking (3-2 BBKSBFK).				
3787869	3	33					Holt, J. flied out to rf (1-2 BKK).
3787869	3	34					Wehby, G lined out to ss (2-1 KBB).
3787869	3	35					Correa, C. grounded out to ss (2-2 KFBB).
3787869	3	36	R: 0 H: 0 E: 0 LOB: 0	2	0	2-0	R: 0 H: 0 E: 0 LOB: 0
3787869	4	37	Parenty doubled down the lf line (0-2 KKF).				
3787869	4	38	Parenty stole third.				
3787869	4	39	Chavarria walked (3-1 BKBBB).				
3787869	4	40	Petty, R. to p for Frazier, M..				
3787869	4	41	Peragine doubled down the rf line, 2 RBI (2-1 BKB): Chavarria scored: Parenty scored.	4	0	4-0	
3787869	4	42	Baker grounded out to 2b (0-2 KF): Peragine advanced to third.				
3787869	4	43	Caputo singled to third base, RBI (1-0 B): Peragine scored.	5	0	5-0	
3787869	4	44	Caputo stole second.				
3787869	4	45	Handley struck out looking (3-2 BBKKBK).				
3787869	4	46	Gazzola popped up to ss (0-2 KS).				
3787869	4	47					Stevens, S. struck out swinging (0-2 FFFFS).
3787869	4	48					Shermer, A. walked (3-2 KBBKFBB).
3787869	4	49					Reese, K. flied out to lf (1-0 B).
3787869	4	50					Vandevere, T singled to center field (2-0 BB): Shermer, A. advanced to second.
3787869	4	51					Zorn, D. lined out to 1b (0-0).
3787869	4	52	R: 3 H: 3 E: 0 LOB: 1	5	0	5-0	R: 0 H: 1 E: 0 LOB: 2
3787869	5	53	Honeyman walked (3-2 BBKBKB).				
3787869	5	54	Giles grounded out to p, SAC, bunt (1-0 B): Honeyman advanced to second.				
3787869	5	55	Parenty flied out to rf, SAC (0-0): Honeyman advanced to third.				
3787869	5	56	Chavarria grounded out to p (1-2 KBK).				
3787869	5	57					Morales, J. walked (3-1 BBBKB).
3787869	5	58					Holt, J. grounded out to 2b (1-1 KB): Morales, J. advanced to second.
3787869	5	59					Wehby, G hit into double play ss to 2b: Morales, J. out on the play.
3787869	5	60	R: 0 H: 0 E: 0 LOB: 1	5	0	5-0	R: 0 H: 0 E: 0 LOB: 0
3787869	6	61	Thiac, Z. to p for Petty, R..				
3787869	6	62	Peragine singled up the middle (2-2 KBKB).				
3787869	6	63	Baker lined into double play 1b unassisted (2-2 KKBFB): Peragine out on the play.				
3787869	6	64	Caputo struck out looking (3-2 BSSBBK).				
3787869	6	65					Lee to p for Honahan.
3787869	6	66					Correa, C. flied out to cf (2-2 SKBFB).
3787869	6	67					Stevens, S. popped up to ss (3-2 FBBSFB).
3787869	6	68					Shermer, A. struck out swinging (0-2 KKS).
3787869	6	69	R: 0 H: 1 E: 0 LOB: 0	5	0	5-0	R: 0 H: 0 E: 0 LOB: 0
3787869	7	70	Handley hit by pitch (2-1 BBK).				
3787869	7	71	Gazzola singled, bunt (1-1 BF): Handley advanced to second, advanced to third on an error by 1b.				
3787869	7	72	.				
3787869	7	73	Honeyman struck out swinging (1-2 SSBS).				
3787869	7	74	Hileman, E. to p for Thiac, Z..				
3787869	7	75	Handley scored on a wild pitch, unearned.	6	0	6-0	
3787869	7	76	Gazzola advanced to second on a wild pitch.				
3787869	7	77	Gazzola advanced to third.				
3787869	7	78	Giles grounded out to ss (3-1 BSBB).				
3787869	7	79	Parenty grounded out to 2b (2-2 KBFB).				
3787869	7	80					Kernan to p for Lee.
3787869	7	81					Reese, K. lined out to 2b (2-0 BB).
3787869	7	82					Vandevere, T tripled to center field (2-1 FBB).
3787869	7	83					Zorn, D. grounded out to p (1-1 BK).
3787869	7	84					Morales, J. hit by pitch (0-1 K).
3787869	7	85					Holt, J. walked (3-2 BBKKBB): Morales, J. advanced to second.
3787869	7	86					Wehby, G struck out looking (0-2 KFK).
3787869	7	87	R: 1 H: 1 E: 1 LOB: 1	6	0	6-0	R: 0 H: 1 E: 0 LOB: 3
3787869	8	88	McDonald, J. to p for Hileman, E..				
3787869	8	89	Chavarria flied out to cf (1-2 FKB).				
3787869	8	90	Peragine walked (3-1 BBKBB).				
3787869	8	91	Baker grounded out to 2b (3-2 BBKBK): Peragine advanced to second.				
3787869	8	92	Caputo grounded out to ss (1-0 B).				
3787869	8	93					Rodliff to p for Kernan.
3787869	8	94					Correa, C. grounded out to 3b (2-2 KFBFB).
3787869	8	95					Stevens, S. singled up the middle (1-2 KBS).
3787869	8	96					Stevens, S. advanced to second on a balk.
3787869	8	97					Shermer, A. struck out swinging (1-2 KSBFFS).
3787869	8	98					Reese, K. flied out to lf (1-2 KBKF).
3787869	8	99	R: 0 H: 0 E: 0 LOB: 1	6	0	6-0	R: 0 H: 1 E: 0 LOB: 1
3787807	0	0	Byrne singled up the middle.				
3787807	0	1	Byrne picked off, out at first p to 1b.				
3787807	0	2	DeMaria struck out swinging.				
3787807	0	3	Guiliano struck out swinging.				
3787807	0	4					Ring popped up to ss.
3787807	0	5					Lester walked.
3787807	0	6					Howard singled; Lester advanced to second.
3787807	0	7					Lavy lined out to 2b; Lester out on the play, out at second 2b to ss.
3787807	0	8	R: 0 H: 1 E: 0 LOB: 0	0	0	0-0	R: 0 H: 1 E: 0 LOB: 1
3787807	1	9	Palummo singled up the middle.				
3787807	1	10	Palummo stole second.				
3787807	1	11	Mistretta struck out swinging.				
3787807	1	12	Beckett struck out swinging.				
3787807	1	13	DiVico singled, RBI; Palummo scored.	1	0	1-0	
3787807	1	14	Budesa singled through the right side; DiVico advanced to second.				
3787807	1	15	Bruno, T struck out looking.				
3787807	1	16					Harris out at first 1b to p.
3787807	1	17					Munson flied out to lf.
3787807	1	18					Ivory struck out swinging, reached first on a passed ball.
3787807	1	19					Klages flied out to cf.
3787807	1	20	R: 1 H: 3 E: 0 LOB: 2	1	0	1-0	R: 0 H: 0 E: 0 LOB: 1
3787807	2	21	Byrne singled up the middle.				
3787807	2	22	DeMaria grounded out to p, bunt; Byrne advanced to second.				
3787807	2	23	Guiliano grounded out to ss; Byrne advanced to third.				
3787807	2	24	Palummo hit by pitch.				
3787807	2	25	Mistretta walked; Palummo advanced to second.				
3787807	2	26	Mistretta advanced to second on a passed ball; Palummo advanced to third on a passed ball; Byrne scored on a passed ball, unearned.	2	0	2-0	
3787807	2	27	Beckett struck out looking.				
3787807	2	28					Peel singled.
3787807	2	29					Ring grounded out to 2b; Peel advanced to second.
3787807	2	30					Peel advanced to third on a balk.
3787807	2	31					Lester flied out to lf; Peel out on the play, out at home lf to c.
3787807	2	32	R: 1 H: 1 E: 0 LOB: 2	2	0	2-0	R: 0 H: 1 E: 0 LOB: 0
3787807	3	33	DiVico grounded out to ss.				
3787807	3	34	Budesa struck out swinging.				
3787807	3	35	Bruno, T struck out swinging.				
3787807	3	36					Howard flied out to cf.
3787807	3	37					Lavy grounded out to 2b.
3787807	3	38					Harris struck out swinging.
3787807	3	39	R: 0 H: 0 E: 0 LOB: 0	2	0	2-0	R: 0 H: 0 E: 0 LOB: 0
3787807	4	40	Byrne grounded out to 2b.				
3787807	4	41	DeMaria flied out to 1b.				
3787807	4	42	Guiliano reached on an error by cf.				
3787807	4	43	Guiliano out on the play, caught stealing, out at second c to ss.				
3787807	4	44					Munson struck out swinging.
3787807	4	45					Ivory struck out swinging.
3787807	4	46					Klages walked.
3787807	4	47					Peel doubled to left field; Klages advanced to third.
3787807	4	48					Ring grounded out to p.
3787807	4	49	R: 0 H: 0 E: 1 LOB: 0	2	0	2-0	R: 0 H: 1 E: 0 LOB: 2
3787807	5	50	Palummo grounded out to 1b unassisted.				
3787807	5	51	Mistretta grounded out to ss.				
3787807	5	52	Beckett struck out swinging.				
3787807	5	53					Lester grounded out to 2b.
3787807	5	54					Howard hit by pitch.
3787807	5	55					Lavy grounded out to ss; Howard advanced to second.
3787807	5	56					Harris popped up to 2b.
3787807	5	57	R: 0 H: 0 E: 0 LOB: 0	2	0	2-0	R: 0 H: 0 E: 0 LOB: 1
3787807	6	58	Miles to p for Fairbanks.				
3787807	6	59	DiVico walked.				
3787807	6	60	Budesa grounded out to p, bunt; DiVico advanced to second.				
3787807	6	61	Bruno, T hit by pitch.				
3787807	6	62	Tribby to p for Miles.				
3787807	6	63	Byrne singled to right field; Bruno, T advanced to second; DiVico advanced to third.				
3787807	6	64	DeMaria singled to left field, RBI; Byrne advanced to second; Bruno, T advanced to third; DiVico scored.	3	0	3-0	
3787807	6	65	Guiliano popped up to 3b.				
3787807	6	66	Palummo reached on a fielder's choice, out at second ss to 2b.				
3787807	6	67					Munson grounded out to 3b.
3787807	6	68					Ivory reached on an error by p, advanced to third.
3787807	6	69		3	1	3-1	Klages grounded out to 2b; Ivory scored, unearned.
3787807	6	70					Peel walked.
3787807	6	71					Peel stole second.
3787807	6	72		3	2	3-2	Ring singled, RBI; Peel scored, unearned.
3787807	6	73					Ring out on the play, caught stealing, out at second c to ss.
3787807	6	74	R: 1 H: 2 E: 0 LOB: 3	3	2	3-2	R: 2 H: 1 E: 1 LOB: 0
3787807	7	75	Mistretta lined out to 3b.				
3787807	7	76	Beckett flied out to cf.				
3787807	7	77	DiVico struck out swinging.				
3787807	7	78					Daddino to p for Maier.
3787807	7	79					Lester walked.
3787807	7	80					Lester advanced to second on a wild pitch, advanced to third.
3787807	7	81					Howard popped up to 2b.
3787807	7	82		3	3	3-3	Lavy singled, RBI; Lester scored.
3787807	7	83					Harris walked; Lavy advanced to second.
3787807	7	84					Harris advanced to second on a wild pitch; Lavy advanced to third on a wild pitch.
3787807	7	85					Munson struck out swinging.
3787807	7	86					Ivory struck out swinging.
3787807	7	87	R: 0 H: 0 E: 0 LOB: 0	3	3	3-3	R: 1 H: 1 E: 0 LOB: 2
3787807	8	88	Williams to p for Tribby.				
3787807	8	89	Budesa flied out to cf.				
3787807	8	90	Bruno, T struck out looking.				
3787807	8	91	Byrne struck out swinging.				
3787807	8	92					Klages walked.
3787807	8	93					Peel singled; Klages advanced to second.
3787807	8	94					Ring walked; Peel advanced to second; Klages advanced to third.
3787807	8	95		3	4	3-4	Lester walked, RBI; Ring advanced to second; Peel advanced to third; Klages scored.
3787807	8	96	R: 0 H: 0 E: 0 LOB: 0	3	4	3-4	R: 1 H: 1 E: 0 LOB: 3
3788809	0	0	Charles struck out swinging.				
3788809	0	1	Williams hit by pitch.				
3788809	0	2	Williams out at first p to 1b, picked off.				
3788809	0	3	Peavey struck out swinging.				
3788809	0	4					ELDER,Mendez struck out swinging.
3788809	0	5					MOORE,J. singled to left center.
3788809	0	6					RICHARDS,D. reached on a fielder's choice: MOORE,J. advanced to second on an error by ss.
3788809	0	7					SIKES,C. hit by pitch: RICHARDS,D. advanced to second: MOORE,J. advanced to third.
3788809	0	8		0	2	0-2	BRIGHAM,Z. doubled down the rf line, 2 RBI: SIKES,C. advanced to third: RICHARDS,D. scored: MOORE,J. scored, unearned.
3788809	0	9					MITCHELL,M. to dh for GLOVER,Kenny.
3788809	0	10					MITCHELL,M. struck out swinging.
3788809	0	11		0	4	0-4	MCCRANIE,R. doubled to right center, 2 RBI: BRIGHAM,Z. scored, unearned: SIKES,C. scored, unearned.
3788809	0	12					JACKSON,D. flied out to cf.
3788809	0	13	R: 0 H: 0 E: 0 LOB: 0	0	4	0-4	R: 4 H: 3 E: 1 LOB: 1
3788809	1	14	Burl II, E. struck out swinging.				
3788809	1	15	Lewis singled to third base.				
3788809	1	16	Carroll struck out swinging.				
3788809	1	17	Lynch singled up the middle: Lewis advanced to second.				
3788809	1	18	Vives struck out swinging.				
3788809	1	19					BENITEZ,H. walked.
3788809	1	20					ELDER,Mendez hit into double play 3b to 2b to 1b: BENITEZ,H. out on the play.
3788809	1	21					MOORE,J. grounded out to ss.
3788809	1	22	R: 0 H: 2 E: 0 LOB: 2	0	4	0-4	R: 0 H: 0 E: 0 LOB: 0
3788809	2	23	Walker struck out swinging.				
3788809	2	24	Charles hit by pitch.				
3788809	2	25	Charles advanced to second on a passed ball.				
3788809	2	26	Williams flied out to cf: Charles advanced to third.				
3788809	2	27	Peavey reached on an error by ss: Charles scored, unearned.	1	4	1-4	
3788809	2	28	Burl II, E. flied out to cf.				
3788809	2	29					RICHARDS,D. grounded out to ss.
3788809	2	30					SIKES,C. doubled down the rf line.
3788809	2	31					SIKES,C. out at third p to 3b, caught stealing.
3788809	2	32					BRIGHAM,Z. walked.
3788809	2	33					MITCHELL,M. out at first 1b to p.
3788809	2	34	R: 1 H: 0 E: 1 LOB: 1	1	4	1-4	R: 0 H: 1 E: 0 LOB: 1
3788809	3	35	Lewis struck out swinging.				
3788809	3	36	Carroll homered to center field, RBI.	2	4	2-4	
3788809	3	37	Lynch flied out to rf.				
3788809	3	38	Vives singled to left field.				
3788809	3	39	Walker grounded out to ss.				
3788809	3	40					MCCRANIE,R. grounded out to 3b.
3788809	3	41					JACKSON,D. walked.
3788809	3	42					BENITEZ,H. walked: JACKSON,D. advanced to second.
3788809	3	43					BENITEZ,H. advanced to second on a wild pitch: JACKSON,D. advanced to third on a wild pitch.
3788809	3	44					ELDER,Mendez walked.
3788809	3	45					MOORE,J. hit into double play 2b to ss to 1b: ELDER,Mendez out on the play.
3788809	3	46	R: 1 H: 2 E: 0 LOB: 1	2	4	2-4	R: 0 H: 0 E: 0 LOB: 2
3788809	4	47	Charles flied out to cf.				
3788809	4	48	Williams grounded out to ss.				
3788809	4	49	Peavey struck out swinging.				
3788809	4	50					RICHARDS,D. hit by pitch.
3788809	4	51					SIKES,C. walked: RICHARDS,D. advanced to second.
3788809	4	52					Smith to p for Belmont.
3788809	4	53					BRIGHAM,Z. hit by pitch: SIKES,C. advanced to second: RICHARDS,D. advanced to third.
3788809	4	54					MITCHELL,M. struck out swinging.
3788809	4	55					MCCRANIE,R. struck out swinging.
3788809	4	56		2	5	2-5	JACKSON,D. singled to center field, RBI: BRIGHAM,Z. advanced to second: SIKES,C. advanced to third: RICHARDS,D. scored.
3788809	4	57		2	7	2-7	BENITEZ,H. singled to right field, 2 RBI: JACKSON,D. advanced to second, out at third rf to 3b: BRIGHAM,Z. scored: SIKES,C. scored.
3788809	4	58	R: 0 H: 0 E: 0 LOB: 0	2	7	2-7	R: 3 H: 2 E: 0 LOB: 1
3788809	5	59	Burl II, E. singled to left field.				
3788809	5	60	Lewis struck out swinging: Burl II, E. out at second c to 2b, caught stealing.				
3788809	5	61	Carroll walked.				
3788809	5	62	ROUSSE,Chris to p for DENNY,Austin.				
3788809	5	63	Lynch walked: Carroll advanced to second.				
3788809	5	64	Walden pinch ran for Lynch.				
3788809	5	65	Vives flied out to cf.				
3788809	5	66					ELDER,Mendez walked.
3788809	5	67					ELDER,Mendez out at second p to 1b to ss, picked off.
3788809	5	68					MOORE,J. struck out swinging.
