game_id	period_id	event_id	team_text	team_score	opponent_score	score	opponent_text
3788840	0	10	R: 1 H: 2 E: 0 LOB: 1	1	0	1-0	R: 0 H: 1 E: 1 LOB: 2
3788840	1	11	Coman, R. lined out to 3b (2-1).				
3788840	1	12	Thaiss, M. homered to right field, RBI (1-2).	2	0	2-0	
3788840	1	13	Woodruff, T. grounded out to 3b (3-1).				
3788840	1	14	Novak, J. struck out swinging (0-2).				
3788840	1	15					MORGAN, K. singled through the right side (0-1).
3788840	1	16					MORGAN, K. out at second c to 2b, caught stealing.
3788840	1	17					NELSON, J. singled through the right side (3-2).
3788840	1	18					YORGEN, C. singled to center field (0-0); NELSON, J. advanced to second.
3788840	1	19					ALLEN, H. struck out swinging (1-2).
3788840	1	20		2	1	2-1	BROOKS, G. singled to center field, RBI (1-1); YORGEN, C. advanced to second; NELSON, J. scored.
3788840	1	21					LAMM, P. struck out swinging (0-2).
3788840	1	22	R: 1 H: 1 E: 0 LOB: 0	2	1	2-1	R: 1 H: 4 E: 0 LOB: 2
3788840	2	23	Clement, E. flied out to lf (0-1).				
3788840	2	24	Haseley, A. grounded out to ss (0-2).				
3788840	2	25	Pinero, D. grounded out to 3b (2-2).				
3788840	2	26					TYLER, E. struck out swinging (3-2).
3788840	2	27					LOWERY walked (3-1).
3788840	2	28					LOWERY advanced to second on a wild pitch.
3788840	2	29					WATKINS, T. struck out swinging (2-2).
3788840	2	30					MORGAN, K. struck out looking (2-2).
3788840	2	31	R: 0 H: 0 E: 0 LOB: 0	2	1	2-1	R: 0 H: 0 E: 0 LOB: 1
3788840	3	32	Towns, K. grounded out to 3b (2-2).				
3788840	3	33	Smith, P. singled through the left side (0-0).				
3788840	3	34	Coman, R. grounded out to 3b (1-0); Smith, P. advanced to second.				
3788840	3	35	Thaiss, M. flied out to rf (0-0).				
3788840	3	36					NELSON, J. grounded out to 2b (2-0).
3788840	3	37					YORGEN, C. doubled down the lf line (2-2).
3788840	3	38					ALLEN, H. grounded out to 2b (0-1); YORGEN, C. advanced to third.
3788840	3	39					BROOKS, G. struck out swinging (3-2).
3788840	3	40	R: 0 H: 1 E: 0 LOB: 1	2	1	2-1	R: 0 H: 1 E: 0 LOB: 1
3788840	4	41	Woodruff, T. lined out to 1b (2-1).				
3788840	4	42	Novak, J. grounded out to ss (0-1).				
3788840	4	43	Clement, E. grounded out to p (0-2).				
3788840	4	44					LAMM, P. singled through the left side (3-2).
3788840	4	45					TYLER, E. hit by pitch (2-2); LAMM, P. advanced to second.
3788840	4	46					Roberts, J. to p for Waddell, B..
3788840	4	47					LOWERY flied out to cf (2-2); LAMM, P. advanced to third.
3788840	4	48					TYLER, E. advanced to second on a wild pitch.
3788840	4	49					WATKINS, T. walked (3-0).
3788840	4	50		2	2	2-2	MORGAN, K. grounded out to 1b unassisted, RBI (0-0); WATKINS, T. advanced to second; TYLER, E. advanced to third; LAMM, P. scored.
3788840	4	51					NELSON, J. popped up to 2b (0-1).
3788840	4	52	R: 0 H: 0 E: 0 LOB: 0	2	2	2-2	R: 1 H: 1 E: 0 LOB: 2
3788840	5	53	Haseley, A. flied out to cf (1-2).				
3788840	5	54	Pinero, D. walked (3-2).				
3788840	5	55	Pinero, D. advanced to second on a wild pitch.				
3788840	5	56	Towns, K. walked (3-0); Pinero, D. stole third.				
3788840	5	57	DURAZO to p for LUCROY.				
3788840	5	58	Smith, P. struck out looking (1-2).				
3788840	5	59	Towns, K. advanced to second on a wild pitch.				
3788840	5	60	Coman, R. walked (3-0).				
3788840	5	61	Thaiss, M. flied out to cf (2-1).				
3788840	5	62					YORGEN, C. grounded out to 1b unassisted (1-0).
3788840	5	63					ALLEN, H. singled down the rf line (0-1).
3788840	5	64					BROOKS, G. flied out to cf to right center (1-1).
3788840	5	65					LAMM, P. popped up to 2b (2-2).
3788840	5	66	R: 0 H: 0 E: 0 LOB: 3	2	2	2-2	R: 0 H: 1 E: 0 LOB: 1
3788840	6	67	BOYD, J. to p for DURAZO.				
3788840	6	68	Woodruff, T. struck out swinging (3-2).				
3788840	6	69	Novak, J. grounded out to p, bunt (0-0).				
3788840	6	70	Clement, E. singled to center field (0-1).				
3788840	6	71	Haseley, A. grounded out to 2b (1-0).				
3788840	6	72					TYLER, E. flied out to rf (3-2).
3788840	6	73					LOWERY struck out swinging (2-2).
3788840	6	74					WATKINS, T. flied out to cf (1-1).
3788840	6	75	R: 0 H: 1 E: 0 LOB: 1	2	2	2-2	R: 0 H: 0 E: 0 LOB: 0
3788840	7	76	Pinero, D. grounded out to 2b (0-1).				
3788840	7	77	Towns, K. singled through the right side (1-2).				
3788840	7	78	Smith, P. doubled to center field (0-0); Towns, K. advanced to third.				
3788840	7	79	Coman, R. grounded out to 2b, RBI (0-0); Smith, P. advanced to third; Towns, K. scored.	3	2	3-2	
3788840	7	80	Thaiss, M. singled through the left side, RBI (0-1); Smith, P. scored.	4	2	4-2	
3788840	7	81	Woodruff, T. hit by pitch (3-2); Thaiss, M. advanced to second.				
3788840	7	82	Novak, J. reached on a fielder's choice (1-0); Woodruff, T. out at second ss to 2b.				
3788840	7	83					MORGAN, K. flied out to cf (2-2).
3788840	7	84					NELSON, J. flied out to cf (1-0).
3788840	7	85					YORGEN, C. flied out to cf (0-0).
3788840	7	86	R: 2 H: 3 E: 0 LOB: 2	4	2	4-2	R: 0 H: 0 E: 0 LOB: 0
3788840	8	87	Clement, E. singled, bunt (0-0).				
3788840	8	88	Haseley, A. grounded out to c, SAC, bunt (1-0); Clement, E. advanced to second.				
3788840	8	89	Pinero, D. struck out looking (2-2).				
3788840	8	90	BOYD, J. to lf for LAMM, P..				
3788840	8	91	INGLE, J. to p for WATKINS, T..				
3788840	8	92	/  for BOYD, J..				
3788840	8	93	Towns, K. struck out swinging (1-2).				
3788840	8	94					Sborz, J. to p for Roberts, J..
3788840	8	95					ALLEN, H. grounded out to p (1-2).
3788840	8	96					BROOKS, G. struck out looking (2-2).
3788840	8	97					BOYD, J. popped up to ss (3-2).
3788840	8	98	R: 0 H: 1 E: 0 LOB: 1	4	2	4-2	R: 0 H: 0 E: 0 LOB: 0
3788805	0	0	Davis walked (3-2).				
3788805	0	1	Scaggari grounded out to p, SAC; Davis advanced to second.				
3788805	0	2	Davis stole third.				
3788805	0	3	Davis out at home ss to c.				
3788805	0	4	Carroll, Dls reached on a fielder's choice.				
3788805	0	5	Simmons struck out swinging (1-2).				
3788805	0	6					Burcham,S walked (3-2).
3788805	0	7					Esposito,V singled to left field (0-2); Burcham,S advanced to second.
3788805	0	8					Lehman,D flied out to rf to left center (0-0); Esposito,V advanced to second; Burcham,S advanced to third.
3788805	0	9		0	2	0-2	Lukes,N doubled to left center, 2 RBI (1-2); Esposito,V scored; Burcham,S scored.
3788805	0	10					Lewis,C struck out swinging (1-2).
3788805	0	11					Hunley,B grounded out to 3b (1-0).
3788805	0	12	R: 0 H: 0 E: 0 LOB: 1	0	2	0-2	R: 2 H: 2 E: 0 LOB: 1
3788805	1	13	Rose, Jayson flied out to cf (1-1).				
3788805	1	14	Smith, W. grounded out to ss (0-0).				
3788805	1	15	Larsen flied out to cf (3-2).				
3788805	1	16					Pollman,G grounded out to ss (1-1).
3788805	1	17					Grubbs,B flied out to cf (0-0).
3788805	1	18					Deely,D struck out swinging (1-2).
3788805	1	19	R: 0 H: 0 E: 0 LOB: 0	0	2	0-2	R: 0 H: 0 E: 0 LOB: 0
3788805	2	20	Jackson, A. struck out swinging (2-2).				
3788805	2	21	Young, AJ doubled to left field (2-0).				
3788805	2	22	Davis popped up to ss (2-2).				
3788805	2	23	Young, AJ advanced to third on a wild pitch.				
3788805	2	24	Scaggari popped up to 1b (1-1).				
3788805	2	25					Burcham,S flied out to cf (2-1).
3788805	2	26		0	3	0-3	Esposito,V homered to left center, RBI (1-0).
3788805	2	27					Lehman,D grounded out to 2b (0-0).
3788805	2	28					Lukes,N flied out to rf (0-0).
3788805	2	29	R: 0 H: 1 E: 0 LOB: 1	0	3	0-3	R: 1 H: 1 E: 0 LOB: 0
3788805	3	30	Carroll, Dls popped up to 1b (1-1).				
3788805	3	31	Simmons singled to right field (2-1).				
3788805	3	32	Rose, Jayson lined out to cf (1-1).				
3788805	3	33	Smith, W. flied out to rf (0-1).				
3788805	3	34					Lewis,C singled to center field (0-0).
3788805	3	35					Hunley,B struck out swinging (1-2).
3788805	3	36					Pollman,G singled to left field (0-0); Lewis,C advanced to second.
3788805	3	37					Grubbs,B walked (3-1); Pollman,G advanced to second; Lewis,C advanced to third.
3788805	3	38		0	4	0-4	Deely,D singled to left field, RBI (1-0); Grubbs,B advanced to second; Pollman,G advanced to third; Lewis,C scored.
3788805	3	39		0	5	0-5	Burcham,S flied out to cf, SF, RBI (1-1); Pollman,G scored.
3788805	3	40					Deely,D stole second; Grubbs,B stole third.
3788805	3	41					Esposito,V grounded out to 3b (3-2).
3788805	3	42	R: 0 H: 1 E: 0 LOB: 1	0	5	0-5	R: 2 H: 3 E: 0 LOB: 2
3788805	4	43	Larsen lined out to lf (1-1).				
3788805	4	44	Jackson, A. flied out to cf (1-0).				
3788805	4	45	Young, AJ lined out to 1b (1-2).				
3788805	4	46					Thomas, T. to p for Duke.
3788805	4	47					Lehman,D walked (3-2).
3788805	4	48					Lukes,N singled to center field (0-0); Lehman,D advanced to second.
3788805	4	49					Lewis,C grounded out to 1b unassisted (3-2); Lukes,N advanced to second; Lehman,D advanced to third.
3788805	4	50		0	6	0-6	Hunley,B singled to right field, RBI (0-1); Lukes,N advanced to third; Lehman,D scored.
3788805	4	51		0	7	0-7	Pollman,G reached on a fielder's choice, SAC, RBI (0-0); Hunley,B advanced to second; Lukes,N scored.
3788805	4	52					Grubbs,B reached on a fielder's choice (1-2); Pollman,G out at second 3b to 2b; Hunley,B advanced to third.
3788805	4	53					Grubbs,B stole second.
3788805	4	54					Deely,D walked (3-2).
3788805	4	55		0	8	0-8	Burcham,S walked, RBI (3-2); Deely,D advanced to second; Grubbs,B advanced to third; Hunley,B scored.
3788805	4	56					Stoltz, T. to p for Thomas, T..
3788805	4	57		0	10	0-10	Esposito,V singled to right field, 2 RBI (2-2); Burcham,S advanced to third; Deely,D scored; Grubbs,B scored.
3788805	4	58					Lehman,D grounded out to 2b (2-0).
3788805	4	59	R: 0 H: 0 E: 0 LOB: 0	0	10	0-10	R: 5 H: 3 E: 0 LOB: 2
3788805	5	60	Root,A to p for Long,S.				
3788805	5	61	Davis walked (3-1).				
3788805	5	62	Scaggari singled to left field (1-0); Davis advanced to second.				
3788805	5	63	Carroll, Dls singled to right field, RBI (1-1); Scaggari advanced to third; Davis scored.	1	10	1-10	
3788805	5	64	Carroll, Dls out at second c to 2b, caught stealing.				
3788805	5	65	Simmons flied out to cf, SF, RBI (2-2); Scaggari scored.	2	10	2-10	
3788805	5	66	Rose, Jayson grounded out to ss (2-1).				
3788805	5	67					Lukes,N out at first 1b to p (0-1).
3788805	5	68					Lewis,C singled to left field (0-0).
3788805	5	69					Lewis,C advanced to second on an error by 1b.
3788805	5	70					Hunley,B flied out to cf (3-1); Lewis,C advanced to third.
3788805	5	71					Pollman,G grounded out to 3b (0-0).
3788805	5	72	R: 2 H: 2 E: 0 LOB: 0	2	10	2-10	R: 0 H: 1 E: 1 LOB: 1
3788805	6	73	Beardsley,T to p for Root,A.				
3788805	6	74	Smith, W. out at first 1b to p (2-2).				
3788805	6	75	Larsen struck out swinging, out at first c to 1b (1-2).				
3788805	6	76	Jackson, A. flied out to cf (1-1).				
3788805	6	77					Grubbs,B lined out to 3b (2-2).
3788805	6	78					Deely,D grounded out to p (0-2).
3788805	6	79					Burcham,S struck out swinging (3-2).
3788805	6	80	R: 0 H: 0 E: 0 LOB: 0	2	10	2-10	R: 0 H: 0 E: 0 LOB: 0
3788805	7	81	Paderez,J to p for Beardsley,T.				
3788805	7	82	Young, AJ singled to right field (3-2).				
3788805	7	83	Caspersen pinch ran for Young, AJ.				
3788805	7	84	Davis hit into double play ss to 2b to 1b (0-1); Caspersen out on the play.				
3788805	7	85	Scaggari tripled to left field (1-0).				
3788805	7	86	Carroll, Dls singled to center field, RBI (1-2); Scaggari scored.	3	10	3-10	
3788805	7	87	Carroll, Dls advanced to second on a wild pitch.				
3788805	7	88	Simmons walked (3-1).				
3788805	7	89	Rose, Jayson grounded out to 3b (2-1).				
3788805	7	90					Taylor, Cole to c for Caspersen.
3788805	7	91					Esposito,V struck out swinging (0-2).
3788805	7	92					Rodriguez, H to p for Stoltz, T..
3788805	7	93					Lehman,D struck out looking (1-2).
3788805	7	94					Lukes,N struck out looking (3-2).
3788805	7	95	R: 1 H: 3 E: 0 LOB: 2	3	10	3-10	R: 0 H: 0 E: 0 LOB: 0
3788805	8	96	Smith, W. grounded out to 2b (2-1).				
3788805	8	97	Marruffo, K. pinch hit for Larsen.				
3788805	8	98	Marruffo, K. struck out looking (1-2).				
3788805	8	99	Gulden, Wade pinch hit for Jackson, A..				
3788805	8	100	Gulden, Wade flied out to rf (2-0).				
3788805	8	101	R: 0 H: 0 E: 0 LOB: 0	3	10	3-10	
3788879	0	0	SINATRO grounded out to 3b (1-2 KKB).				
3788879	0	1	GIARRATANO lined out to 3b (2-1 BFB).				
3788879	0	2	ATKINSON struck out swinging (1-2 KFBS).				
3788879	0	3					Smith, S. walked (3-2 BBKKBB).
3788879	0	4					Raley walked (3-2 KBBBFB); Smith, S. advanced to second.
3788879	0	5					Neslony struck out swinging (3-2 BKSBBS).
3788879	0	6					Gutierrez walked (3-0 BBBB); Raley advanced to second; Smith, S. advanced to third.
3788879	0	7		0	1	0-1	Hargrove walked, RBI (3-2 BBBKFFB); Gutierrez advanced to second; Raley advanced to third; Smith, S. scored.
3788879	0	8		0	2	0-2	Proudfoot walked, RBI (3-0 BBBB); Hargrove advanced to second; Gutierrez advanced to third; Raley scored.
3788879	0	9		0	4	0-4	Hairston singled through the left side, 2 RBI (0-1 K); Proudfoot advanced to second; Hargrove scored; Gutierrez scored.
3788879	0	10					Hairston advanced to second on a wild pitch; Proudfoot advanced to third on a wild pitch.
3788879	0	11		0	6	0-6	Davis, M. singled to center field, 2 RBI (1-1 BK); Hairston scored; Proudfoot scored.
3788879	0	12					NARAHARA to p for LEE.
3788879	0	13					Burleson grounded out to ss (2-1 BBK); Davis, M. advanced to second.
3788879	0	14		0	7	0-7	Smith, S. singled up the middle, RBI (1-1 KB); Davis, M. scored.
3788879	0	15					Raley doubled to left field (1-1 SB); Smith, S. advanced to third.
3788879	0	16					Neslony singled to third base (2-1 SBB); Smith, S. out at third p to 3b.
3788879	0	17	R: 0 H: 0 E: 0 LOB: 0	0	7	0-7	R: 7 H: 5 E: 0 LOB: 2
3788879	1	18	HENDRIKS struck out swinging (1-2 KKBS).				
3788879	1	19	MIROGLIO lined out to cf (1-0 B).				
3788879	1	20	SNIDER grounded out to 3b (1-1 KB).				
3788879	1	21					Gutierrez doubled to left center (1-0 B).
3788879	1	22					Hargrove grounded out to 2b (1-1 BF); Gutierrez advanced to third.
3788879	1	23		0	8	0-8	Proudfoot flied out to lf, SF, RBI (0-0); Gutierrez scored.
3788879	1	24					Hairston singled through the left side (1-0 B).
3788879	1	25					Davis, M. lined out to ss (1-0 B).
3788879	1	26	R: 0 H: 0 E: 0 LOB: 0	0	8	0-8	R: 1 H: 2 E: 0 LOB: 1
3788879	2	27	NIXON struck out swinging (1-2 BFFS).				
3788879	2	28	HALL doubled down the lf line (0-1 K).				
3788879	2	29	MATRANGA flied out to lf (0-1 K); HALL advanced to third.				
3788879	2	30	SINATRO singled up the middle, RBI (1-2 KBS); HALL scored.	1	8	1-8	
3788879	2	31	SINATRO advanced to second on a wild pitch.				
3788879	2	32	GIARRATANO singled to right center, RBI (2-1 KBB); SINATRO scored.	2	8	2-8	
3788879	2	33	ATKINSON grounded out to 1b unassisted (1-1 BF).				
3788879	2	34					Burleson flied out to cf (1-1 BF).
3788879	2	35					Smith, S. walked (3-1 BBBKB).
3788879	2	36					Raley flied out to cf (3-1 BBBK).
3788879	2	37					Smith, S. stole second, advanced to third on a throwing error by c.
3788879	2	38					Neslony grounded out to 2b (2-1 BBK).
3788879	2	39	R: 2 H: 3 E: 0 LOB: 1	2	8	2-8	R: 0 H: 0 E: 1 LOB: 1
3788879	3	40	HENDRIKS struck out swinging (1-2 SFBS).				
3788879	3	41	MIROGLIO grounded out to 2b (1-0 B).				
3788879	3	42	SNIDER doubled to left field (1-2 SSB).				
3788879	3	43	NIXON grounded out to ss (1-1 KB).				
3788879	3	44					Gutierrez walked (3-2 BKFBBFB).
3788879	3	45					Hargrove singled through the right side (0-1 F); Gutierrez advanced to second.
3788879	3	46					Proudfoot lined out to 3b (0-0).
3788879	3	47					Hairston reached on a fielder's choice to third base (0-2 SF); Hargrove out at second 3b to 2b; Gutierrez advanced to third.
3788879	3	48					Davis, M. grounded out to 1b unassisted (3-2 BFBBF).
3788879	3	49	R: 0 H: 1 E: 0 LOB: 1	2	8	2-8	R: 0 H: 1 E: 0 LOB: 2
3788879	4	50	HALL grounded out to 3b (2-0 BB).				
3788879	4	51	MATRANGA struck out swinging, out at first c to 1b (1-2 KBSS).				
3788879	4	52	SINATRO grounded out to 2b (0-0).				
3788879	4	53					Burleson grounded out to ss (2-2 KFBB).
3788879	4	54					Smith, S. walked (3-0 BBBB).
3788879	4	55					Raley reached on a fielder's choice to second base (0-2 KF); Smith, S. out at second 2b to ss.
3788879	4	56					Raley out at second p to 1b to ss, picked off, caught stealing.
3788879	4	57	R: 0 H: 0 E: 0 LOB: 0	2	8	2-8	R: 0 H: 0 E: 0 LOB: 0
3788879	5	58	GIARRATANO flied out to rf (2-1 BBK).				
3788879	5	59	ATKINSON singled through the right side (3-1 BSBB).				
3788879	5	60	HENDRIKS grounded into double play 2b to ss to 1b (0-0); ATKINSON out on the play.				
3788879	5	61					VALLEY to cf for SINATRO.
3788879	5	62					McCOY to ss for GIARRATANO.
3788879	5	63					RAMIREZ to 1b for ATKINSON.
3788879	5	64					PUSKARICH to 3b for HENDRIKS.
3788879	5	65					Neslony doubled to left center (2-1 BBK).
3788879	5	66					Gutierrez grounded out to ss (0-2 SF).
3788879	5	67					ULVESTAD to p for NARAHARA.
3788879	5	68		2	9	2-9	Hargrove singled up the middle, RBI (2-1 BBK); Neslony scored.
3788879	5	69					Hargrove advanced to second on a wild pitch.
3788879	5	70					Proudfoot flied out to cf (3-2 SBFFFBB).
3788879	5	71					Hairston hit by pitch (1-0).
3788879	5	72					Hairston stole second; Hargrove stole third.
3788879	5	73					Davis, M. struck out swinging (3-2 KFBBBS).
3788879	5	74	R: 0 H: 1 E: 0 LOB: 0	2	9	2-9	R: 1 H: 2 E: 0 LOB: 2
3788879	6	75	Lancaster to p for Dusek.				
3788879	6	76	MIROGLIO singled through the left side (0-0).				
3788879	6	77	SNIDER flied out to rf (1-0 B).				
3788879	6	78	NIXON lined out to lf (1-1 BK).				
3788879	6	79	HALL singled through the left side (0-0); MIROGLIO advanced to second.				
3788879	6	80	MATRANGA doubled down the lf line, 2 RBI (2-0 BB); HALL scored; MIROGLIO scored.	4	9	4-9	
3788879	6	81	VALLEY flied out to cf (3-1 BBSB).				
3788879	6	82					BUONOPANE to p for ULVESTAD.
3788879	6	83					Burleson lined out to lf (1-0 B).
3788879	6	84					Smith, S. walked (3-0 BBBB).
3788879	6	85					Raley singled through the left side (3-1 BBBK); Smith, S. advanced to third.
3788879	6	86		4	10	4-10	Neslony flied out to lf, SF, RBI (1-2 KKB); Smith, S. scored.
3788879	6	87					Raley stole second.
3788879	6	88					Gutierrez walked (3-2 KBBBKB).
3788879	6	89					Hargrove reached on a fielder's choice to third base (1-1 BS); Gutierrez advanced to second; Raley out at third 3b unassisted.
3788879	6	90	R: 2 H: 3 E: 0 LOB: 1	4	10	4-10	R: 1 H: 1 E: 0 LOB: 2
3788879	7	91	EATON to 2b for HALL.				
3788879	7	92	WEST to p for BUONOPANE.				
3788879	7	93	Taylor to p for Lancaster.				
3788879	7	94	McCOY walked (3-0 BBBB).				
3788879	7	95	McCOY stole second, advanced to third on a throwing error by c.				
3788879	7	96	RAMIREZ struck out looking (2-2 KFBBK).				
3788879	7	97	PUSKARICH grounded out to p (3-2 BSBBF).				
3788879	7	98	MIROGLIO singled to left field, RBI (0-0); McCOY scored, unearned.	5	10	5-10	
3788879	7	99	SNIDER reached on a fielder's choice to shortstop (0-0); MIROGLIO out at second ss to 2b.				
3788879	7	100					Proudfoot flied out to cf (2-2 KBBF).
3788879	7	101					Gardner pinch hit for Hairston.
3788879	7	102					Gardner singled through the right side (0-0).
3788879	7	103					Davis, M. singled to right field (0-0); Gardner advanced to second.
3788879	7	104		5	13	5-13	Burleson homered to left field, 3 RBI (1-1 BK); Davis, M. scored; Gardner scored.
3788879	7	105					Smith, S. grounded out to ss (0-0).
3788879	7	106					Raley tripled to left center (2-1 BKB).
3788879	7	107					Neslony struck out looking (0-2 SSK).
3788879	7	108	R: 1 H: 1 E: 1 LOB: 1	5	13	5-13	R: 3 H: 4 E: 0 LOB: 1
3788879	8	109	NIXON doubled down the lf line (2-2 KBBF).				
3788879	8	110	EATON grounded out to 3b (1-0 B).				
3788879	8	111	MATRANGA hit by pitch (3-2 BBSF).				
3788879	8	112	VALLEY flied out to lf (0-0).				
3788879	8	113	McCOY singled to pitcher (1-1 BK); MATRANGA advanced to second; NIXON advanced to third.				
3788879	8	114	RAMIREZ grounded out to ss (0-2 SK).				
3788879	8	115	R: 0 H: 2 E: 0 LOB: 3	5	13	5-13	
3788038	0	0	GROESBECK struck out looking (1-2 FKBK).				
3788038	0	1	MIZE flied out to cf (2-2 FBBF).				
3788038	0	2	JONES struck out looking (2-2 BKBKK).				
3788038	0	3					Phillips struck out swinging (0-2 KSS).
3788038	0	4					P. Watcher grounded out to 2b (0-0).
3788038	0	5					Mapes struck out swinging (1-2 FKBS).
3788038	0	6	R: 0 H: 0 E: 0 LOB: 0	0	0	0-0	R: 0 H: 0 E: 0 LOB: 0
3788038	1	7	PIERCE struck out swinging (0-2 FSS).				
3788038	1	8	DRAWS fouled out to rf (1-0 B).				
3788038	1	9	HASLAM flied out to cf (0-1 F).				
3788038	1	10		0	1	0-1	Ellis homered to left field, RBI (1-0 B).
3788038	1	11					Walsh struck out swinging (2-2 BSFBS).
3788038	1	12					Stokes singled to center field (0-0).
3788038	1	13					Windham struck out swinging (1-2 BSFS).
3788038	1	14					Rush walked (3-0 BBBB); Stokes advanced to second.
3788038	1	15					Deese struck out looking (2-2 BSSBK).
3788038	1	16	R: 0 H: 0 E: 0 LOB: 0	0	1	0-1	R: 1 H: 2 E: 0 LOB: 2
3788038	2	17	ZABOJNIK popped up to ss (2-2 SSBB).				
3788038	2	18	SALECK walked (3-1 KBBBB).				
3788038	2	19	WILKIE struck out looking (0-2 KKFK).				
3788038	2	20	GROESBECK tripled to left center, RBI (1-0 B); SALECK scored.	1	1	1-1	
3788038	2	21	MIZE flied out to rf (2-2 KBFB).				
3788038	2	22					Phillips grounded out to 3b (3-1 KBBB).
3788038	2	23					P. Watcher out at first 2b to p (2-2 BBKK).
3788038	2	24					Mapes grounded out to 3b (0-1 K).
3788038	2	25	R: 1 H: 1 E: 0 LOB: 1	1	1	1-1	R: 0 H: 0 E: 0 LOB: 0
3788038	3	26	JONES fouled out to c (1-2 FBF).				
3788038	3	27	PIERCE struck out swinging (2-2 SBFFBS).				
3788038	3	28	DRAWS flied out to lf (2-0 BB).				
3788038	3	29					Ellis hit by pitch (2-2 BKS).
3788038	3	30					Walsh flied out to cf (0-0).
3788038	3	31					Ellis out at second p to 1b to ss to p, picked off, caught stealing.
3788038	3	32					Stokes walked (3-2 BBSKBFB).
3788038	3	33					Windham grounded out to 2b (0-0).
3788038	3	34	R: 0 H: 0 E: 0 LOB: 0	1	1	1-1	R: 0 H: 0 E: 0 LOB: 1
3788038	4	35	HASLAM fouled out to 3b (1-2 KBK).				
3788038	4	36	ZABOJNIK flied out to lf (2-2 BKSFB).				
3788038	4	37	SALECK lined out to cf (0-0).				
3788038	4	38					Rush walked (3-2 BKBBKB).
3788038	4	39					Smith pinch ran for Rush.
3788038	4	40					Deese struck out swinging (1-2 KSBS); Smith stole second, advanced to third on a throwing error by c.
3788038	4	41					Phillips flied into double play rf to c (1-0 B); Smith out on the play.
3788038	4	42	R: 0 H: 0 E: 0 LOB: 0	1	1	1-1	R: 0 H: 0 E: 1 LOB: 0
3788038	5	43	Hines to 3b for Smith.				
3788038	5	44	Charpia to rf for Deese.				
3788038	5	45	WILKIE flied out to lf (1-2 KKB).				
3788038	5	46	GROESBECK homered to left field, RBI (1-2 KKB).	2	1	2-1	
3788038	5	47	MIZE singled to right center (0-0).				
3788038	5	48	JONES walked (3-2 BKSBBB); MIZE advanced to second.				
3788038	5	49	JONES advanced to second on a wild pitch; MIZE advanced to third on a wild pitch.				
3788038	5	50	PIERCE walked (3-1 BBSBB).				
3788038	5	51	Lavery to p for Livingston.				
3788038	5	52	DRAWS hit by pitch, RBI (2-1 FB); PIERCE advanced to second; JONES advanced to third; MIZE scored.	3	1	3-1	
3788038	5	53	HASLAM struck out swinging (0-2 KSS).				
3788038	5	54	ZABOJNIK struck out swinging (2-2 BKBFS).				
3788038	5	55					P. Watcher grounded out to 2b (0-0).
3788038	5	56					Mapes reached on an error by ss (3-1 BBBK).
3788038	5	57					Ellis walked (3-0 BBBB); Mapes advanced to second.
3788038	5	58					Walsh out at first 1b to p (3-2 BBSBFF); Ellis advanced to second; Mapes advanced to third.
3788038	5	59		3	3	3-3	Stokes doubled to center field, 2 RBI (1-1 KB); Ellis scored, unearned; Mapes scored, unearned.
3788038	5	60					Windham lined out to rf (2-0 BB).
3788038	5	61	R: 2 H: 2 E: 0 LOB: 3	3	3	3-3	R: 2 H: 1 E: 1 LOB: 1
3788038	6	62	Sears to p for Lavery.				
3788038	6	63	SALECK grounded out to 2b (1-2 KBS).				
3788038	6	64	WILKIE struck out swinging (2-2 KSBBS).				
3788038	6	65	GROESBECK grounded out to 3b (1-2 FFB).				
3788038	6	66					MONAGHAN to p for TROJAN.
3788038	6	67					Hines flied out to lf (1-0 B).
3788038	6	68					Charpia flied out to rf (2-2 BSFB).
3788038	6	69					Phillips struck out swinging (2-2 BBKSS).
3788038	6	70	R: 0 H: 0 E: 0 LOB: 0	3	3	3-3	R: 0 H: 0 E: 0 LOB: 0
3788038	7	71	MIZE grounded out to p, bunt (1-1 BF).				
3788038	7	72	JONES flied out to cf (1-2 KFFB).				
3788038	7	73	PIERCE flied out to rf (3-2 FFBBFB).				
3788038	7	74					STANFORD to p for MONAGHAN.
3788038	7	75					P. Watcher walked (3-2 BBKKBB).
3788038	7	76					Mapes doubled down the lf line (0-0); P. Watcher advanced to third.
3788038	7	77		3	4	3-4	Mapes advanced to third on a balk; P. Watcher scored on a balk.
3788038	7	78		3	5	3-5	Ellis singled to left center, RBI (3-2 FBBFB); Mapes scored.
3788038	7	79					Walsh reached on a fielder's choice (0-1 K); Ellis out at second p to 2b to ss.
3788038	7	80					Stokes doubled down the lf line (0-1 F); Walsh advanced to third.
3788038	7	81					Windham struck out looking (3-2 BBBKFK).
3788038	7	82					Hines hit by pitch (1-0).
3788038	7	83					Martin pinch hit for Charpia.
3788038	7	84		3	8	3-8	Martin tripled to right field, 3 RBI (0-2 SF); Hines scored; Stokes scored; Walsh scored.
3788038	7	85					JACOBS to p for STANFORD.
3788038	7	86					Phillips popped up to ss (3-2 KBBBK).
3788038	7	87	R: 0 H: 0 E: 0 LOB: 0	3	8	3-8	R: 5 H: 4 E: 0 LOB: 1
3788038	8	88	Martin to rf.				
3788038	8	89	DRAWS struck out looking (1-2 KSBK).				
3788038	8	90	HASLAM lined out to cf (0-0).				
3788038	8	91	ZABOJNIK reached on an error by rf, advanced to second (0-1 F).				
3788038	8	92	SALECK struck out swinging (1-2 KBFS).				
3788038	8	93	R: 0 H: 0 E: 1 LOB: 1	3	8	3-8	
3786635	0	0	SMALL grounded out to ss.				
3786635	0	1	HOUSTON grounded out to 2b (3-2 BBFBK).				
3786635	0	2	HOROWITZ struck out looking (2-2 KSBBK).				
3786635	0	3					GIGLIOTTI struck out swinging (2-2 KBSBFS).
3786635	0	4					MASSEY fouled out to 1b (0-1 K).
3786635	0	5					ALLISON grounded out to ss (2-2 BKKB).
3786635	0	6	R: 0 H: 0 E: 0 LOB: 0	0	0	0-0	R: 0 H: 0 E: 0 LOB: 0
3786635	1	7	WOJCIECHOWSK walked (3-1 KBBBB).				
3786635	1	8	MARANTO singled to center field (1-2 BKF); WOJCIECHOWSK advanced to second.				
