game_id	period_id	event_id	team_text	team_score	opponent_score	score	opponent_text
3788871	5	55	McCULLOUGH singled through the left side (2-2 SKBBF).				
3788871	5	56	VALLEY pinch ran for McCULLOUGH.				
3788871	5	57	VALLEY out at second c to ss, caught stealing.				
3788871	5	58	NIXON walked (3-0 BBBB).				
3788871	5	59	McCOY singled to third base (3-2 SBSBB); NIXON advanced to second, out at third 3b to 1b to 3b.				
3788871	5	60					Carpenter singled to shortstop (0-2 KS).
3788871	5	61					Proudfoot fouled out to 1b (1-0 B).
3788871	5	62					Floyd grounded out to 3b, SAC, bunt; Carpenter advanced to second.
3788871	5	63					Smith, S. walked (3-1 BKBBB).
3788871	5	64		4	8	4-8	Burleson singled to left field, RBI (1-0 B); Smith, S. advanced to second; Carpenter scored.
3788871	5	65					NARAHARA to p for SHEW.
3788871	5	66					Neslony struck out swinging (2-2 KBBFS).
3788871	5	67	R: 0 H: 2 E: 0 LOB: 1	4	8	4-8	R: 1 H: 2 E: 0 LOB: 2
3788871	6	68	SINATRO struck out looking (2-2 KBFBFK).				
3788871	6	69	GIARRATANO grounded out to ss (1-2 KKBF).				
3788871	6	70	ATKINSON lined out to lf (0-0).				
3788871	6	71					MEYER to p for NARAHARA.
3788871	6	72					Gutierrez singled through the left side (1-0 B).
3788871	6	73					Hargrove grounded out to p, SAC, bunt (0-0); Gutierrez advanced to second.
3788871	6	74					Gardner pinch hit for Long.
3788871	6	75					Gardner flied out to cf (0-1 K).
3788871	6	76					Carpenter flied out to lf (1-2 KBFF).
3788871	6	77	R: 0 H: 0 E: 0 LOB: 0	4	8	4-8	R: 0 H: 1 E: 0 LOB: 1
3788871	7	78	VALLEY to dh.				
3788871	7	79	Garcia to 3b for Gardner.				
3788871	7	80	Lancaster to p for Patterson.				
3788871	7	81	HENDRIKS hit by pitch (2-1 BF).				
3788871	7	82	MIROGLIO popped up to 2b (0-2 SK).				
3788871	7	83	EATON reached on a fielder's choice to shortstop (0-1 K); HENDRIKS advanced to second on a fielding error by ss.				
3788871	7	84	RAMIREZ pinch hit for VALLEY.				
3788871	7	85	RAMIREZ hit by pitch (2-1 BK); EATON advanced to second; HENDRIKS advanced to third.				
3788871	7	86	HALL pinch hit for NIXON.				
3788871	7	87	Moreno to p for Lancaster.				
3788871	7	88	HALL singled up the middle, 2 RBI (2-1 BBK); RAMIREZ advanced to second; EATON scored; HENDRIKS scored, unearned.	6	8	6-8	
3788871	7	89	McCOY fouled out to 1b (2-2 SBFBFF).				
3788871	7	90	SINATRO struck out looking (2-2 BBFFK).				
3788871	7	91					RAMIREZ to dh.
3788871	7	92					HALL to rf.
3788871	7	93					Proudfoot flied out to cf (0-2 KF).
3788871	7	94		6	9	6-9	Floyd homered to left field, RBI (1-1 BF).
3788871	7	95					Smith, S. popped up to 2b (0-2 SF).
3788871	7	96					Burleson singled to left field (0-0).
3788871	7	97					Burleson advanced to second on a wild pitch.
3788871	7	98					Neslony fouled out to 3b (2-2 KBFB).
3788871	7	99	R: 2 H: 1 E: 1 LOB: 2	6	9	6-9	R: 1 H: 2 E: 0 LOB: 1
3788871	8	100	Davis, Z. to cf for Hargrove.				
3788871	8	101	GIARRATANO popped up to ss (0-0).				
3788871	8	102	ATKINSON doubled to right center (1-1 BK).				
3788871	8	103	HENDRIKS singled through the right side (3-1 FBBB); ATKINSON advanced to third.				
3788871	8	104	MIROGLIO singled through the right side, RBI (1-1 BF); HENDRIKS advanced to second; ATKINSON scored.	7	9	7-9	
3788871	8	105	PUSKARICH pinch hit for EATON.				
3788871	8	106	PUSKARICH grounded into double play 2b to ss to 1b (2-1 BBK); MIROGLIO out on the play.				
3788871	8	107	R: 1 H: 3 E: 0 LOB: 1	7	9	7-9	
3787384	0	0	Barker struck out swinging (1-2).				
3787384	0	1	Lipson grounded out to 2b (0-0).				
3787384	0	2	Bily grounded out to ss (1-2).				
3787384	0	3					Geisler struck out swinging (1-2).
3787384	0	4					Vallieres flied out to rf (3-2).
3787384	0	5					Studdard singled up the middle (0-0).
3787384	0	6					Paiz grounded out to 3b (3-2).
3787384	0	7	R: 0 H: 0 E: 0 LOB: 0	0	0	0-0	R: 0 H: 1 E: 0 LOB: 1
3787384	1	8	Lynch grounded out to ss (2-1).				
3787384	1	9	March reached on a throwing error by 3b (0-0).				
3787384	1	10	Henderson, S reached on a fielder's choice (2-0): March out at second 2b to ss.				
3787384	1	11	Silva reached on a fielder's choice (0-1): Henderson, S out at second ss to 2b.				
3787384	1	12					McElroy grounded out to ss (1-2).
3787384	1	13					Hoffman struck out looking (1-2).
3787384	1	14					Hill struck out swinging (3-2).
3787384	1	15	R: 0 H: 0 E: 1 LOB: 1	0	0	0-0	R: 0 H: 0 E: 0 LOB: 0
3787384	2	16	Williams struck out looking (0-2).				
3787384	2	17	Heptig walked (3-2).				
3787384	2	18	Barker singled to right field (0-2): Heptig advanced to second.				
3787384	2	19	Barker advanced to second on a wild pitch: Heptig advanced to third.				
3787384	2	20	Lipson flied out to rf, SF, RBI (2-1): Barker advanced to third on the throw: Heptig scored.	1	0	1-0	
3787384	2	21	Barker out at home c unassisted, caught stealing.				
3787384	2	22					Sullivan hit by pitch (1-0).
3787384	2	23					Sherley flied out to cf (1-0).
3787384	2	24					Geisler doubled down the lf line (1-0): Sullivan advanced to third.
3787384	2	25					Vallieres walked (3-0).
3787384	2	26		1	1	1-1	Studdard flied out to rf, SF, RBI (1-0): Sullivan scored on the throw.
3787384	2	27		1	3	1-3	Paiz doubled to right center, 2 RBI (0-2): Vallieres scored: Geisler scored.
3787384	2	28					McElroy flied out to rf (3-2).
3787384	2	29	R: 1 H: 1 E: 0 LOB: 0	1	3	1-3	R: 3 H: 2 E: 0 LOB: 1
3787384	3	30	Bily flied out to rf (0-1).				
3787384	3	31	Lynch flied out to cf (1-0).				
3787384	3	32	March lined out to 2b (1-2).				
3787384	3	33		1	4	1-4	Hoffman homered to left field, RBI (3-2).
3787384	3	34					Mullins to p for Koopmans.
3787384	3	35					Hill struck out looking (3-2).
3787384	3	36					Sullivan walked (3-0).
3787384	3	37					Sherley grounded out to 2b (1-1): Sullivan advanced to second.
3787384	3	38		1	5	1-5	Geisler singled to right center, RBI (1-1): Sullivan scored.
3787384	3	39					Vallieres singled up the middle (1-0): Geisler advanced to third.
3787384	3	40					Studdard struck out swinging (2-2).
3787384	3	41	R: 0 H: 0 E: 0 LOB: 0	1	5	1-5	R: 2 H: 3 E: 0 LOB: 2
3787384	4	42	Henderson, S singled to right field (2-0).				
3787384	4	43	Henderson, S stole second.				
3787384	4	44	Silva flied out to rf (2-2): Henderson, S advanced to third on the throw.				
3787384	4	45	Williams struck out swinging, out at first c to 1b (1-2).				
3787384	4	46	Heptig grounded out to 2b (1-1).				
3787384	4	47					Paiz flied out to rf (0-2).
3787384	4	48					McElroy struck out swinging, grounded out to c unassisted (2-2).
3787384	4	49					Hoffman lined out to lf (0-0).
3787384	4	50	R: 0 H: 1 E: 0 LOB: 1	1	5	1-5	R: 0 H: 0 E: 0 LOB: 0
3787384	5	51	Barker struck out looking (0-2).				
3787384	5	52	Lipson hit by pitch (2-1).				
3787384	5	53	Bily fouled out to c (0-0).				
3787384	5	54	Lipson stole second.				
3787384	5	55	Lynch hit by pitch (2-2).				
3787384	5	56	March singled to right field, RBI (3-1): Lynch advanced to second: Lipson scored.	2	5	2-5	
3787384	5	57	Henderson, S singled to pitcher (1-2): March advanced to second, advanced to third on an error by 1b: Lynch scored, unearned.	3	5	3-5	
3787384	5	58	Henderson, S stole second: March out at home c to 2b to c.				
3787384	5	59					Hill flied out to cf (0-1).
3787384	5	60					Sullivan struck out swinging (0-2).
3787384	5	61					Sherley struck out swinging (1-2).
3787384	5	62	R: 2 H: 2 E: 1 LOB: 1	3	5	3-5	R: 0 H: 0 E: 0 LOB: 0
3787384	6	63	Silva grounded out to 3b (0-0).				
3787384	6	64	Williams walked (3-1).				
3787384	6	65	Whitter to p for Humpal.				
3787384	6	66	Williams stole second.				
3787384	6	67	Heptig popped into double play ss unassisted (0-2): Williams out on the play.				
3787384	6	68					Geisler grounded out to c (0-0).
3787384	6	69					Vallieres hit by pitch (3-2).
3787384	6	70					Studdard grounded into double play 2b to ss to 1b (1-1): Vallieres out on the play.
3787384	6	71	R: 0 H: 0 E: 0 LOB: 0	3	5	3-5	R: 0 H: 0 E: 0 LOB: 0
3787384	7	72	Barker hit by pitch (3-2).				
3787384	7	73	Barker stole second.				
3787384	7	74	Lipson singled to left field (3-2): Barker advanced to third.				
3787384	7	75	Bily singled to shortstop, RBI (1-2): Lipson advanced to second: Barker scored.	4	5	4-5	
3787384	7	76	Lynch flied out to rf (1-2).				
3787384	7	77	Pearson to p for Whitter.				
3787384	7	78	March grounded into double play 2b to ss to 1b (2-2): Bily out on the play.				
3787384	7	79					Paiz walked (3-2).
3787384	7	80					Cordy to p for Mullins.
3787384	7	81					Paiz advanced to second on a wild pitch.
3787384	7	82					McElroy grounded out to 2b (2-2): Paiz advanced to third.
3787384	7	83					Hoffman walked (3-1).
3787384	7	84		4	6	4-6	Hill singled to pitcher, RBI (2-1): Hoffman advanced to second: Paiz scored.
3787384	7	85		4	7	4-7	Sullivan singled through the right side, advanced to second on the throw, RBI (2-2): Hill advanced to third: Hoffman scored.
3787384	7	86					Sherley struck out swinging (0-2).
3787384	7	87					Geisler struck out swinging (2-2).
3787384	7	88	R: 1 H: 2 E: 0 LOB: 1	4	7	4-7	R: 2 H: 2 E: 0 LOB: 2
3787384	8	89	Dellinger to p for Pearson.				
3787384	8	90	Henderson, S doubled down the rf line (2-1).				
3787384	8	91	Silva grounded out to p (3-2).				
3787384	8	92	Olson pinch hit for Williams.				
3787384	8	93	Olson walked (3-0).				
3787384	8	94	Pluschkell pinch ran for Olson.				
3787384	8	95	Anderson pinch hit for Heptig.				
3787384	8	96	Powell to p for Dellinger.				
3787384	8	97	Anderson singled through the right side (0-0): Pluschkell advanced to second: Henderson, S advanced to third.				
3787384	8	98	Barker doubled down the lf line, 2 RBI (0-1): Anderson advanced to third: Pluschkell scored: Henderson, S scored.	6	7	6-7	
3787384	8	99	Lipson reached on a fielder's choice (1-2): Barker advanced to third: Anderson out at home p to 3b to c.				
3787384	8	100	Bily singled to left field, RBI (2-2): Lipson advanced to second: Barker scored.	7	7	7-7	
3787384	8	101	Lynch grounded out to 2b (1-2).				
3787384	8	102					Henderson, S to rf.
3787384	8	103					Pluschkell to ss.
3787384	8	104					Novak to 1b for Anderson.
3787384	8	105					Vallieres struck out looking (1-2).
3787384	8	106					Studdard grounded out to p (1-0).
3787384	8	107					Paiz singled to center field (3-2).
3787384	8	108					McElroy walked (3-2): Paiz advanced to second.
3787384	8	109					Sanchez pinch ran for Paiz.
3787384	8	110					Hoffman struck out swinging (2-2).
3787384	8	111	R: 3 H: 4 E: 0 LOB: 2	7	7	7-7	R: 0 H: 1 E: 0 LOB: 2
3787384	9	112	Vallieres to 3b.				
3787384	9	113	Hubbard to 2b for Sanchez.				
3787384	9	114	March walked (3-2).				
3787384	9	115	Henderson, S grounded out to p, SAC, bunt (0-1): March advanced to second.				
3787384	9	116	Silva doubled, ground-rule, RBI (0-0): March scored.	8	7	8-7	
3787384	9	117	Mitchell to p for Powell.				
3787384	9	118	Pluschkell singled up the middle, RBI (2-2): Silva.	9	7	9-7	
3787384	9	119	Pluschkell stole second.				
3787384	9	120	Novak walked (3-2).				
3787384	9	121	Barker hit by pitch (1-0): Novak advanced to second: Pluschkell advanced to third.				
3787384	9	122	Lipson singled to left field, RBI (3-1): Barker advanced to second: Novak advanced to third: Pluschkell scored.	10	7	10-7	
3787384	9	123	Atwood to p for Mitchell.				
3787384	9	124	Bily grounded into double play 2b to ss to 1b (3-2): Lipson out on the play.				
3787384	9	125					Stone to p for Cordy.
3787384	9	126					Hill grounded out to ss (1-1).
3787384	9	127					Sullivan struck out swinging (2-2).
3787384	9	128					Sherley grounded out to 1b unassisted (1-1).
3787384	9	129	R: 3 H: 3 E: 0 LOB: 2	10	7	10-7	R: 0 H: 0 E: 0 LOB: 0
3788781	0	0	SMALL popped up to 2b (1-2 SBFF).				
3788781	0	1	HOUSTON lined out to rf (2-1 FBB).				
3788781	0	2	HOROWITZ grounded out to 3b (1-2 BKK).				
3788781	0	3					GIGLIOTTI singled up the middle (3-2 BBKBKF).
3788781	0	4					MASSEY flied out to cf (0-2 SF).
3788781	0	5					ALLISON singled to left field (2-2 BBFS); GIGLIOTTI advanced to second.
3788781	0	6					HANKS grounded into double play 3b to 1b (0-1 K); GIGLIOTTI out on the play.
3788781	0	7	R: 0 H: 0 E: 0 LOB: 0	0	0	0-0	R: 0 H: 2 E: 0 LOB: 1
3788781	1	8	WOJCIECHOWSK flied out to cf (2-1 KBB).				
3788781	1	9	MARANTO struck out swinging (0-2 KFS).				
3788781	1	10	MARRAS doubled to left center (1-0 B).				
3788781	1	11	FRIES homered to left field, 2 RBI (1-0 B); MARRAS scored.	2	0	2-0	
3788781	1	12	CHRISTMAN singled up the middle (2-2 KKBB).				
3788781	1	13	PARKER struck out swinging (1-2 BFKS).				
3788781	1	14					ASHCRAFT walked (3-0 BBBB).
3788781	1	15					LEE, J. reached on an error by ss (1-2 BKF); ASHCRAFT advanced to second.
3788781	1	16		2	1	2-1	VAZQUEZ singled up the middle, RBI (0-0); LEE, J. advanced to third; ASHCRAFT scored.
3788781	1	17		2	2	2-2	KORTE grounded out to p, SAC, bunt, RBI (0-0); VAZQUEZ advanced to second; LEE, J. scored.
3788781	1	18					LEE, A. singled through the left side (1-0 B); VAZQUEZ advanced to third.
3788781	1	19					GIGLIOTTI reached on a fielder's choice, bunt (0-0); LEE, A. advanced to second; VAZQUEZ out at home p to 1b.
3788781	1	20		2	3	2-3	MASSEY singled to left field, advanced to second on the throw, RBI (2-0 BB); GIGLIOTTI advanced to third; LEE, A. scored, unearned.
3788781	1	21					ALLISON walked (3-1 KBBBB).
3788781	1	22					HANKS flied out to cf (1-0 B).
3788781	1	23	R: 2 H: 3 E: 0 LOB: 1	2	3	2-3	R: 3 H: 3 E: 1 LOB: 3
3788781	2	24	SMALL grounded out to ss (1-2 BKF).				
3788781	2	25	HOUSTON flied out to rf (3-2 BBSKB).				
3788781	2	26	HOROWITZ grounded out to 3b (2-2 SBBK).				
3788781	2	27					ASHCRAFT popped up to 1b (0-0).
3788781	2	28					LEE, J. grounded out to 2b (2-2 KFFBB).
3788781	2	29					VAZQUEZ grounded out to ss (1-0 B).
3788781	2	30	R: 0 H: 0 E: 0 LOB: 0	2	3	2-3	R: 0 H: 0 E: 0 LOB: 0
3788781	3	31	WOJCIECHOWSK flied out to cf (2-2 BSBSF).				
3788781	3	32	MARANTO grounded out to ss (1-2 FBSF).				
3788781	3	33	MARRAS singled down the rf line (1-2 BKFFF).				
3788781	3	34	FRIES singled to third base (0-0); MARRAS advanced to second.				
3788781	3	35	CHRISTMAN walked (3-0 BBBB); FRIES advanced to second; MARRAS advanced to third.				
3788781	3	36	PARKER grounded out to p (1-1 BF).				
3788781	3	37					KORTE flied out to cf (0-1 K).
3788781	3	38					LEE, A. singled through the left side (0-1 K).
3788781	3	39					GIGLIOTTI singled, bunt (1-0 B); LEE, A. advanced to second.
3788781	3	40					MASSEY grounded out to ss (1-2 BFS); GIGLIOTTI advanced to second; LEE, A. advanced to third.
3788781	3	41		2	5	2-5	ALLISON reached on an error by 2b, out at first rf to 1b (0-0); GIGLIOTTI scored, unearned; LEE, A. scored, unearned.
3788781	3	42	R: 0 H: 2 E: 0 LOB: 3	2	5	2-5	R: 2 H: 2 E: 1 LOB: 0
3788781	4	43	WELLER to p for ANDROS.				
3788781	4	44	SMALL grounded out to 3b (1-0 B).				
3788781	4	45	HOUSTON singled to shortstop (3-1 FBBB).				
3788781	4	46	HOUSTON stole second.				
3788781	4	47	HOUSTON advanced to third on a wild pitch.				
3788781	4	48	HOROWITZ struck out swinging (3-2 KBBFBS).				
3788781	4	49	WOJCIECHOWSK popped up to ss (2-0 BB).				
3788781	4	50					HANKS doubled to left field (0-2 FF).
3788781	4	51					ASHCRAFT grounded out to 2b (0-2 FS); HANKS advanced to third.
3788781	4	52					LEE, J. lined out to 1b (1-0 B).
3788781	4	53					VAZQUEZ grounded out to ss (0-0).
3788781	4	54	R: 0 H: 1 E: 0 LOB: 1	2	5	2-5	R: 0 H: 1 E: 0 LOB: 1
3788781	5	55	MARANTO walked (3-0 BBBB).				
3788781	5	56	MARANTO out at second c to 2b, caught stealing.				
3788781	5	57	MARRAS walked (3-1 BBKBB).				
3788781	5	58	FRIES fouled out to 1b (0-0).				
3788781	5	59	PRYOR to p for WELLER.				
3788781	5	60	QUINTERO pinch hit for CHRISTMAN.				
3788781	5	61	QUINTERO reached on a fielder's choice (1-2 BSFF); MARRAS out at second ss to 2b.				
3788781	5	62					MILLER to 2b for QUINTERO.
3788781	5	63					KORTE grounded out to 2b (0-2 KKF).
3788781	5	64		2	6	2-6	LEE, A. homered to left field, RBI (0-0).
3788781	5	65					GIGLIOTTI singled, bunt (0-1 F).
3788781	5	66					MASSEY grounded into double play ss to 2b to 1b (0-0); GIGLIOTTI out on the play.
3788781	5	67	R: 0 H: 0 E: 0 LOB: 1	2	6	2-6	R: 1 H: 2 E: 0 LOB: 0
3788781	6	68	KSENIAK pinch hit for PARKER.				
3788781	6	69	KSENIAK fouled out to 1b (2-2 SFBFB).				
3788781	6	70	SMALL grounded out to 2b (1-0 B).				
3788781	6	71	HOUSTON grounded out to 2b (0-1 F).				
3788781	6	72					BARTOLONE to rf for KSENIAK.
3788781	6	73					ALLISON singled to third base (1-0 B).
3788781	6	74					HANKS lined into double play 3b to 1b (1-0 B); ALLISON out on the play.
3788781	6	75					ASHCRAFT singled to right center (1-1 FB).
3788781	6	76					LEE, J. grounded out to 3b.
3788781	6	77	R: 0 H: 0 E: 0 LOB: 0	2	6	2-6	R: 0 H: 2 E: 0 LOB: 1
3788781	7	78	HOROWITZ walked (3-0 BBBB).				
3788781	7	79	WOJCIECHOWSK flied out to lf (1-2 KBF).				
3788781	7	80	MARANTO walked (3-1 KBBBB); HOROWITZ advanced to second.				
3788781	7	81	CURTIS to p for PRYOR.				
3788781	7	82	MARRAS singled through the left side (2-2 BFBFFF); MARANTO advanced to second; HOROWITZ advanced to third.				
3788781	7	83	MALLOY pinch ran for MARRAS.				
3788781	7	84	Dropped foul ball, E2.				
3788781	7	85	FRIES struck out swinging (3-2 BBBKFFFS).				
3788781	7	86	MILLER hit by pitch, RBI (2-1 BKB); MALLOY advanced to second; MARANTO advanced to third; HOROWITZ scored, unearned.	3	6	3-6	
3788781	7	87	MILLER advanced to second on a passed ball; MALLOY advanced to third on a passed ball; MARANTO scored on a passed ball, unearned.	4	6	4-6	
3788781	7	88	BARTOLONE struck out looking (1-2 BKKK).				
3788781	7	89					AMADOR to c for MALLOY.
3788781	7	90					MITCHELL to p for MYJAK.
3788781	7	91					VAZQUEZ flied out to cf (0-1 K).
3788781	7	92					KORTE walked (3-2 FKBBBB).
3788781	7	93					LEE, A. singled to center field (3-2 BKSBBF); KORTE advanced to second.
3788781	7	94					GIGLIOTTI singled, bunt (0-0); LEE, A. advanced to second; KORTE advanced to third.
3788781	7	95		4	7	4-7	MASSEY hit by pitch, RBI (0-0); GIGLIOTTI advanced to second; LEE, A. advanced to third; KORTE scored.
3788781	7	96		4	8	4-8	ALLISON walked, RBI (3-1 BBKBB); MASSEY advanced to second; GIGLIOTTI advanced to third; LEE, A. scored.
3788781	7	97					ALLEN to p for MITCHELL.
3788781	7	98					HANKS lined into double play 3b to 2b (0-1 F); MASSEY out on the play.
3788781	7	99	R: 2 H: 1 E: 1 LOB: 2	4	8	4-8	R: 2 H: 2 E: 0 LOB: 2
3788781	8	100	MOORE to p for CURTIS.				
3788781	8	101	SMALL doubled to right center (0-2 SK).				
3788781	8	102	HOUSTON singled to right field (1-2 KKB); SMALL advanced to third.				
3788781	8	103	HOROWITZ doubled to left center, RBI (1-0 B); HOUSTON advanced to third; SMALL scored.	5	8	5-8	
3788781	8	104	WOJCIECHOWSK grounded out to 3b (3-1 KBBB).				
3788781	8	105	MARANTO doubled to right field, RBI (3-1 BFBB); HOROWITZ advanced to third; HOUSTON scored.	6	8	6-8	
3788781	8	106	AMADOR grounded out to ss, RBI (0-0); HOROWITZ scored.	7	8	7-8	
3788781	8	107	FRIES doubled to right center, RBI (0-0); MARANTO scored.	8	8	8-8	
3788781	8	108	MILLER hit by pitch (1-1 BF).				
3788781	8	109	BARTOLONE grounded out to ss (0-0).				
3788781	8	110					ASHCRAFT singled up the middle (1-1 KB).
3788781	8	111					LEE, J. walked (3-0 BBBB); ASHCRAFT advanced to second.
3788781	8	112					SOLOMON pinch hit for VAZQUEZ.
3788781	8	113					BROWN pinch ran for LEE, J..
3788781	8	114					SOLOMON grounded out to 3b, SAC, bunt (0-1 K); BROWN advanced to second; ASHCRAFT advanced to third.
3788781	8	115					KORTE walked (3-0 BBBB).
3788781	8	116		8	9	8-9	LEE, A. hit by pitch, RBI (0-0); KORTE advanced to second; BROWN advanced to third; ASHCRAFT scored.
3788781	8	117	R: 4 H: 5 E: 0 LOB: 2	8	9	8-9	R: 1 H: 1 E: 0 LOB: 3
3787884	0	0	Parenty reached on an error by p (0-1 K).				
3787884	0	1	Parenty stole second.				
3787884	0	2	Parenty advanced to third on a passed ball.				
3787884	0	3	Chavarria reached on an error by ss (1-2 KFFFFBF): Parenty scored, unearned.	1	0	1-0	
3787884	0	4	Peragine singled to right field (0-1 F): Chavarria advanced to third.				
3787884	0	5	Baker struck out swinging (1-2 BSSFS).				
3787884	0	6	Caputo struck out swinging (3-2 KBFBBFS).				
3787884	0	7	Handley flied out to cf (0-0).				
3787884	0	8					Holt, J. struck out looking (2-2 FKFBBFK).
3787884	0	9					Knight, D. hit by pitch (0-0).
3787884	0	10					Correa, C. hit by pitch (1-0 B): Knight, D. advanced to second.
3787884	0	11					Stevens, S. struck out swinging (2-2 BBKSS): Knight, D. stole third.
3787884	0	12					Vandevere, T lined out to p (0-0).
3787884	0	13	R: 1 H: 1 E: 2 LOB: 2	1	0	1-0	R: 0 H: 0 E: 0 LOB: 2
3787884	1	14	Gazzola grounded out to 2b (2-2 KBBSF).				
3787884	1	15	Honeyman reached on an error by 1b (0-1 K).				
3787884	1	16	Giles flied out to rf (0-0).				
3787884	1	17	Parenty singled to left field (0-0): Honeyman advanced to second.				
3787884	1	18	Chavarria singled up the middle (3-2 KBBBK): Parenty advanced to second: Honeyman advanced to third.				
3787884	1	19	Peragine flied out to rf (1-2 BKKF).				
3787884	1	20					Reese, K. tripled to center field (0-0).
3787884	1	21		1	1	1-1	Shermer, A. singled to first base, RBI (2-2 SKFBFB): Reese, K. scored.
3787884	1	22					Zorn, D. struck out swinging (1-2 FKBS).
3787884	1	23					Shermer, A. out at second p to 1b to ss, picked off.
3787884	1	24					Morales, J. grounded out to 1b unassisted (0-0).
3787884	1	25	R: 0 H: 2 E: 1 LOB: 3	1	1	1-1	R: 1 H: 2 E: 0 LOB: 0
3787884	2	26	Baker popped up to lf (3-2 KBBKB).				
3787884	2	27	Caputo hit by pitch (1-2 FBSF).				
3787884	2	28	Handley flied out to lf (2-0 BB).				
3787884	2	29	Gazzola struck out swinging, out at first c to 1b (2-2 BBFKS).				
3787884	2	30					Holt, J. grounded out to ss (0-0).
3787884	2	31					Knight, D. grounded out to ss (2-1 BFB).
3787884	2	32					Correa, C. doubled to left field (0-2 KK).
3787884	2	33					Stevens, S. struck out looking (3-2 BBBFFK).
3787884	2	34	R: 0 H: 0 E: 0 LOB: 1	1	1	1-1	R: 0 H: 1 E: 0 LOB: 1
3787884	3	35	Honeyman grounded out to 2b (0-1 K).				
3787884	3	36	Giles struck out swinging (0-2 FKFS).				
3787884	3	37	Parenty grounded out to 2b (1-0 B).				
3787884	3	38					Vandevere, T struck out swinging (1-2 KKBS).
3787884	3	39					Reese, K. struck out swinging (1-2 KSBS).
3787884	3	40					Shermer, A. singled to center field (3-1 BBFB).
3787884	3	41					Shermer, A. advanced to second on an error by p, advanced to third, unearned.
3787884	3	42					Zorn, D. struck out swinging (2-2 KBKBS).
3787884	3	43	R: 0 H: 0 E: 0 LOB: 0	1	1	1-1	R: 0 H: 1 E: 1 LOB: 1
3787884	4	44	Ernestine, A to p for Borne, G..				
3787884	4	45	Chavarria walked (3-1 BKBBB).				
3787884	4	46	Chavarria advanced to second on a passed ball.				
3787884	4	47	Peragine grounded out to ss (2-2 KKBBFFF): Chavarria advanced to third.				
3787884	4	48	Baker popped up to ss (2-0 BB).				
3787884	4	49	Petty, R. to p for Ernestine, A.				
3787884	4	50	Caputo lined out to 1b (1-2 SKB).				
3787884	4	51					Morales, J. struck out looking (1-2 BKKK).
3787884	4	52					Holt, J. popped up to 2b (3-2 BKFBBF).
3787884	4	53					Knight, D. singled through the left side (1-0 B).
3787884	4	54					Knight, D. advanced to second on a passed ball.
3787884	4	55					Correa, C. intentionally walked (1-1 KB).
3787884	4	56					Tucker, A. pinch hit for Stevens, S..
3787884	4	57					Tucker, A. grounded out to p (2-2 BBKK).
3787884	4	58	R: 0 H: 0 E: 0 LOB: 1	1	1	1-1	R: 0 H: 1 E: 0 LOB: 2
3787884	5	59	Deemes, R. to p for Petty, R..				
3787884	5	60	Handley grounded out to ss (2-2 KBBF).				
3787884	5	61	Gazzola singled to shortstop (0-0).				
3787884	5	62	Honeyman grounded out to 3b (3-2 KBBKBFF): Gazzola advanced to second.				
3787884	5	63	Giles reached on a fielder's choice (0-0): Gazzola out at third lf to c.				
3787884	5	64					DiEva to p for Zamora.
3787884	5	65					Vandevere, T walked (3-0 BBBB).
3787884	5	66					Reese, K. flied out to lf (3-2 BFBFFFFBF).
3787884	5	67					Shermer, A. singled up the middle (2-2 KBBKFF): Vandevere, T advanced to second.
3787884	5	68					Zorn, D. struck out looking (0-2 SFFFK).
3787884	5	69					Morales, J. grounded out to 2b (1-1 BF).
3787884	5	70	R: 0 H: 1 E: 0 LOB: 1	1	1	1-1	R: 0 H: 1 E: 0 LOB: 2
3787884	6	71	Parenty struck out swinging (1-2 KSBS).				
3787884	6	72	Chavarria grounded out to ss (1-1 KB).				
3787884	6	73	Peragine singled up the middle (1-0 B).				
3787884	6	74	Baker flied out to lf (3-2 BSKBB).				
3787884	6	75					Holt, J. singled to left field (3-1 BBBK).
3787884	6	76					Knight, D. singled, bunt (0-0): Holt, J. advanced to second.
3787884	6	77					Corniel to p for DiEva.
3787884	6	78		1	2	1-2	Correa, C. flied out to cf, RBI (2-2 KBSBF): Knight, D. advanced to third: Holt, J. advanced to third, scored on an error by lf, unearned.
3787884	6	79					.
3787884	6	80					.
3787884	6	81		1	3	1-3	Knight, D. stole home, unearned.
3787884	6	82					Tucker, A. reached on an error by c, advanced to second.
3787884	6	83					Wehby, G pinch ran for Tucker, A..
3787884	6	84					Vandevere, T popped up to ss (0-0).
3787884	6	85					.
3787884	6	86		1	4	1-4	Reese, K. doubled to center field, RBI (2-2 FFFBB): Wehby, G scored, unearned.
3787884	6	87					Shermer, A. struck out swinging (0-2 SSS).
3787884	6	88	R: 0 H: 1 E: 0 LOB: 1	1	4	1-4	R: 3 H: 3 E: 2 LOB: 1
3787884	7	89	Wehby, G to dh.				
3787884	7	90	Caputo singled through the right side (0-2 KS).				
3787884	7	91	Handley fouled out to 1b (1-1 BK).				
3787884	7	92	Gazzola struck out looking (0-2 KFK).				
3787884	7	93	Honeyman grounded out to 2b (2-2 BKBK).				
3787884	7	94					Zorn, D. hit by pitch.
3787884	7	95					Morales, J. grounded out to p, SAC, bunt (0-1 F): Zorn, D. advanced to second.
3787884	7	96					Holt, J. popped up to 2b (0-1 K).
3787884	7	97					Knight, D. struck out swinging (2-2 BKBSS).
3787884	7	98	R: 0 H: 1 E: 0 LOB: 1	1	4	1-4	R: 0 H: 0 E: 0 LOB: 1
3787884	8	99	Holmes, S. to p for Deemes, R..				
3787884	8	100	Giles grounded out to ss (1-2 KKFB).				
3787884	8	101	Parenty flied out to cf (0-1 F).				
3787884	8	102	Chavarria grounded out to 3b (0-1 K).				
3787884	8	103	R: 0 H: 0 E: 0 LOB: 0	1	4	1-4	
3787809	0	0	Byrne flied out to cf.				
